	AI_Prov_Name	File_Date	File_Count	Group_Count	Ethnicity	IEP	LEP	Gender	Ven_Stud_ID	Grade	Stud_Test_ID	Score_Flag	Item_ID	Item_Response	Final_Score	Data_Point	Read1_Date	Read1_ID	Read1_Score	Read1_Cond	Read2_Date	Read2_ID	Read2_Score	Read2_Cond	Read3_Date	Read3_ID	Read3_Score	Read3_Cond	Read5_Date	Read5_ID	Read5_Score	Read5_Cond	Alert_Code	Alert_ReaderID
0	AI-XC	20131119122102	500	500	H	N	N	M	362764	11	10617167	Y	49151	i don't know																				
1	AI-XC	20131119122102	500	500	W	N	N	F	363070	11	10617168	Y	49151	"This sentence relates to the authors opinion about light pollution in the sense that even though our population is very large, we use too much light. The author clearly agrees with this when she says ""We've grown so used to this pervasive orange haze that the original glory of an unlit night-dark enough for the planet Venus to throw shadows on Earth-is wholly beyond our experience, beyond memory almost."""																				
2	AI-XC	20131119122102	500	500	B	N	N	F	363293	11	10617169	Y	49151	"This sentence realtes to the authors opinion about light pollution because ""Light pollution is largely the result of bad lughting design which allows artificial light to shine outaward into the sky, where its not wanted, instead of focusing it downward, where it is"" Explain how he feels about light pollution."																				
3	AI-XC	20131119122102	500	500	W	N	N	M	364302	11	10617170	Y	49151	Yes.																				
4	AI-XC	20131119122102	500	500	NR			F	364319	11	10617171	Y	49151	The sentence relates to the author's opinon about light pollution																				
5	AI-XC	20131119122102	500	500	NR			F	364418	11	10617172	Y	49151	This relates to the author's opinion because the author doesn't think we should waste light.																				
6	AI-XC	20131119122102	500	500	H	N	N	M	364832	11	10617173	Y	49151	This realtes to the author's opinion about light pollution because it talks about how we have so muich light that we act like if it a part of the world. For the past century or so, we've been performing expeiments on shortening the night and extending the day.																				
7	AI-XC	20131119122102	500	500	H	N	N	M	364843	11	10617174	Y	49151	hi																				
8	AI-XC	20131119122102	500	500	H	N	Y	M	364945	11	10617175	Y	49151	it realtes to his opinion beacause he wants to conserve eneregy																				
9	AI-XC	20131119122102	500	500	NR			M	367372	11	10617176	Y	49151	i think the author really hates that we're using soo much light and that it's unnecessary.																				
10	AI-XC	20131119122102	500	500	B	N	N	M	367956	11	10617177	Y	49151	Light pollution is  most needed in our country because we are a busy country.																				
11	AI-XC	20131119122102	500	500	B			F	368323	11	10617178	Y	49151	This sentence relates to the author's opinion because it's saying how we use light more than anything and its polluting the earth.																				
12	AI-XC	20131119122102	500	500	W		N	F	368599	11	10617179	Y	49151	This sentance relates to the authors opinion about the text because it shows how he feels that humans disregard the well-being of the planet and only focus on their own needs. In the first paragraph the author writes how we have engineered the night to recieve us by filing it with artificial life.																				
13	AI-XC	20131119122102	500	500	W		N	F	368600	11	10617180	Y	49151	this sentance shows the authors opinion on light pollution by stating in the sentance that we are wrong if she felt differently she would agree with people and not against them.																				
14	AI-XC	20131119122102	500	500	NR			F	369154	11	10617181	Y	49151	They keep lights on in the night. No matter how much light pollution they put out.																				
15	AI-XC	20131119122102	500	500	NR			M	371645	11	10617182	Y	49151	It shows that the author does not like light pollution.																				
16	AI-XC	20131119122102	500	500	NR	N		F	373474	11	10617183	Y	49151	"The author believes the people are wasting light as a resource, which affects us greatly. The people have been ""filling it with light"" (1). The people are accustomed to the daylight, which affects the biological clocks of human beings."																				
17	AI-XC	20131119122102	500	500	W	N	N	F	373510	11	10617184	Y	49151	Saying that we use light enough to be unoccupied but we are the complete opposite and we use so much light we are ruining nature and ourselves.																				
18	AI-XC	20131119122102	500	500	W	Y	N	M	373620	11	10617185	Y	49151	light pollution is bad and people are over using light like we really need that much light, when we really don't																				
19	AI-XC	20131119122102	500	500	NR			F	374430	11	10617186	Y	49151	because the author is describing the damage of light and lighting up the night is not good.																				
20	AI-XC	20131119122102	500	500	NR			F	376411	11	10617187	Y	49151	"It is trying to say that we use more light then we did back in the day. ""In most cities the sky looks as though it had been emptied of stars, leaving behins a vacant haze that mirrors our fear of the dark."""																				
21	AI-XC	20131119122102	500	500	H	N	N	M	376945	11	10617188	Y	49151	"One detail helps explain the qoute and is "" now most of humanity lives under intersecting domes of reflected, refracted light , of scattering rays from overlit cities, and suburbs, from light-flooded highways and factories""."																				
22	AI-XC	20131119122102	500	500	H	N	N	F	376949	11	10617189	Y	49151	"The authors opinion about the light pollution is that we don't care what  we are doing to our world. like the author said, ""For most of human history, the phrase 'light pollution' would have made no sense."", now our world doesn't see what we are really doing."																				
23	AI-XC	20131119122102	500	500	W	N	N	F	378390	11	10617190	Y	49151	People use too much light and it makes us look fake.																				
24	AI-XC	20131119122102	500	500	H	N	Y	M	379715	11	10617191	Y	49151	this sentence relates by the what it sayes in the pasig.																				
25	AI-XC	20131119122102	500	500	W	N	N	M	379859	11	10617192	Y	49151	"We use all the light we want, and dont worry about the consequences that come from it. Like the author says ""we've lit up the night as if it wer an unoccupied country...""."																				
26	AI-XC	20131119122102	500	500	B			M	382853	11	10617193	Y	49151	The author is trying to say that humans use too much light and it's starting to take a toll on the planet.																				
27	AI-XC	20131119122102	500	500	H	N	N	M	383160	11	10617194	Y	49151	it means that since it wasnt lit it looked unoccupied, they needed to light it up.																				
28	AI-XC	20131119122102	500	500	A	N	Y	F	383162	11	10617195	Y	49151	This explians nothing can be done by true .																				
29	AI-XC	20131119122102	500	500	B	N	N	M	383164	11	10617196	Y	49151	ther using light they dont need to and its a waste																				
30	AI-XC	20131119122102	500	500	NR			F	384084	11	10617197	Y	49151	This sentence relates to the authors opinion by showing the reader that we as people have created a world where not only at night, but even during the day, we continuously subject light pollution by our man made energy sources and cause much damage to our natural world; such as the oceans and forests as the author has said.																				
31	AI-XC	20131119122102	500	500	NR			F	384139	11	10617198	Y	49151	We humans constantly rely on light to see, whether it be in our own homes or even outside when walking around town. We constantly give light pollution just so we can see and experience the world at night.																				
32	AI-XC	20131119122102	500	500	A	Y	Y	F	384569	11	10617199	Y	49151	It is good to tell the truth then lieing.																				
33	AI-XC	20131119122102	500	500	H	N	N	M	384637	11	10617200	Y	49151	i dont know																				
34	AI-XC	20131119122102	500	500	NR			M	386728	11	10617201	Y	49151	"It means when it was dark there looked like there was no life, when he said ""We've lit up the night as if it were an unoccupied country."""																				
35	AI-XC	20131119122102	500	500	NR			M	387362	11	10617202	Y	49151	This relates to the author's opinion about light pollution because he believes that we've lit up the night like it were and unoccupied country.																				
36	AI-XC	20131119122102	500	500	W			F	387773	11	10617203	Y	49151	"The author feels that there is to much light pollution. If there wasn't so much light in the night time then it would be a lot better. ""Now most of humanity lives under intersecting domes of reflected, refracted light, of scattering rays from overlit cities and suburbs, from light flooded highways and factories."""																				
37	AI-XC	20131119122102	500	500	B	N	N	M	388043	11	10617204	Y	49151	"This sentence relates to the suthor's opinion because it supports his idea about excessive use of light. ""Now most of humanity lives under intersecting domes of reflected, refracted light, scattering rays from overlit cities and suburbs, from light-flooded highways and factories"" Klinkenborg says."																				
38	AI-XC	20131119122102	500	500	H	N	N	F	390040	11	10617205	Y	49151	"""Migrating at night, birds are apt to collide with brightly lit tall buildings..."", the author states. This text relates to the above text because it talks about all the lights that are lit up around the world."																				
39	AI-XC	20131119122102	500	500	B	N	N	F	390369	11	10617206	Y	49151	"the author feels that we have litten up the night sky as if it were an unoccupied country . example ""we've lit up the night as if it were an unoccupied country, when nothing could be further from the truth"																				
40	AI-XC	20131119122102	500	500	W	N	N	M	393112	11	10617207	Y	49151	The quote is relevant to the passage because of the connection he/she is making relates to human curosity and discovery. Our curosity lite up our world, and we lite it up because we want to learn more about our home. It was the nail in the coffin, the flag in our moon if you will.  Also, just a quick comment. I am not one to usually complain but I taking this test does not benefit us only you. If you really wanted to make this test for students who WILL be taking this, test it on them so they now what it will be like. Thank you and think logically next time.																				
41	AI-XC	20131119122102	500	500	W	N	N	F	393113	11	10617208	Y	49151	???																				
42	AI-XC	20131119122102	500	500	W	N	N	M	393114	11	10617209	Y	49151	"The light pollution we give off can be seen from space, as said in the text ""burning brighter, in fact, than Buenos Aires or Rio De Janeiro"" shows that our populated cities give off a lot of light to push back the dark but in the same way we lit up the sky like its unoccupied because you usually have the lights on in your house when you are not in the room when its dark, and things of that nature."																				
43	AI-XC	20131119122102	500	500	W	Y	N	M	394158	11	10617210	Y	49151	we lit up the night without considerig the other animals and how it mey affect them																				
44	AI-XC	20131119122102	500	500	W	N	N	M	395927	11	10617211	Y	49151	The author uses this example to show the reader how we take the ability to light the the world, for granite, and how we abuse it in our every day (and night) life.  Now, we have even become accustomed to the light, and that is why we fear the darkness today, because we fear the unknown, and the darkness is now unknown to the average human being because we have spoiled ourselves with the ability to light up the world when we know that it is not essential.																				
45	AI-XC	20131119122102	500	500	W	N	N	M	398176	11	10617212	Y	49151	It relates because, we think that when we pollute with light it is only affecting us but, in fact we are affecting the people around us.																				
46	AI-XC	20131119122102	500	500	W	N	N	M	399330	11	10617213	Y	49151	Where there are humans there s light, so an unoccupied city would have no light and be more helpful to the enviorment.																				
47	AI-XC	20131119122102	500	500	W	N	N	F	399331	11	10617214	Y	49151	This relates to the author's opinion because it is saying that we are wrong to light up the sky at night which means she is against and very aware of light pollution. In the text she explains how many affects light pollution on not just humans but animals, this just gives more examples in proving she is against light pollution.																				
48	AI-XC	20131119122102	500	500	W			F	400309	11	10617215	Y	49151	Night is occupied by many nocturnal creatures. Light pollution damages these creatures and diurnal creatures circadian rhythems																				
49	AI-XC	20131119122102	500	500	W	N		F	400374	11	10617216	Y	49151	"The author thinks people are pretty careless about pollution and that humans aren't really thinking through what they're doing to our planet. The author is very against light pollution and you can tell when they say, ""If humans were truly at home under the light of the moon and stars, we would go in darkness happily"""																				
50	AI-XC	20131119122102	500	500	W	N		F	400902	11	10617217	Y	49151	We light up the nights so much that we don't need that much light because we should only use the light from the stars and moon. If we only had the stars and moon, people would go to bed peacefully and not worry about lights being on everywhere.																				
51	AI-XC	20131119122102	500	500	H	N	N	F	405130	11	10617218	Y	49151	idk																				
52	AI-XC	20131119122102	500	500	W	N	N	M	408757	11	10617219	Y	49151	"He doesnt like it. He believes that when we go to sleep the lights should be turned off. ""Ill-designed lighting washes out the darkness of night and radically alters the light levels-and light rhythms-to which many forms of human light spills into the natural world, some aspect of life-migration, reproduction,feeding-is all afffected."""																				
53	AI-XC	20131119122102	500	500	H	N	Y	M	409931	11	10617220	Y	49151	too much frequency																				
54	AI-XC	20131119122102	500	500	NR			M	411414	11	10617221	Y	49151	The author believes mankind thinks that the night is treated as a separate world then the day, and that the night should e made the same as the day. He believes on the contrary, that they are the same and should both be unaltered. Also, if we alter the night, the natural beauty of the stars at night will be removed from our lives. There would only be the less-captivating daytime.																				
55	AI-XC	20131119122102	500	500	W			M	411515	11	10617222	Y	49151	we light up the sky like its not effecting anybody, when really it is, there are plenty of birds that get distracted duing migration form the light, like it said, light is almost like a magnet.																				
56	AI-XC	20131119122102	500	500	H	N	Y	M	412400	11	10617223	Y	49151	This relates the authors opinion about light pollution by saying that all of humanity has now been using artificial light.																				
57	AI-XC	20131119122102	500	500	H	N	N	M	412518	11	10617224	Y	49151	Humanity ignores the bad effects of light pollution and is uninformed causing us to destroy our planet ,which ultimitly is leading the human race on a path of self-destruction and is doomed if they don't change their ways.																				
58	AI-XC	20131119122102	500	500	W		N	F	413224	11	10617225	Y	49151	"This sentence relates to the author's opinion about light pollution by including the unoccupied country reference. In the text the author states, ""light pollution is largely the result of bad lighting design..."". This relates to the sentence because an unoccupied country has no people, so it wouldn't have much light in the first place."																				
59	AI-XC	20131119122102	500	500	P			F	413507	11	10617226	Y	49151	"For me, I feel that the sentence relates to the author's opinion about light pollution because it says that while in other countrys are not looking into this and figuring out an answer the author is saying that ""among mammals alone the number of nocturnal species is astonishing"". So this why I feel that the sentence above is related to the authors opinion."																				
60	AI-XC	20131119122102	500	500	H	N	Y	F	413584	11	10617227	Y	49151	Most humans live under intersecting domes of reflected or refracted light if scattering rays from cites.																				
61	AI-XC	20131119122102	500	500	H	N	Y	F	413592	11	10617228	Y	49151	It relates to the author because its saying that the night is going to light up in a country. For example it say that in south Atlantic it glows and things like that.																				
62	AI-XC	20131119122102	500	500	H	N	Y	F	413632	11	10617229	Y	49151	We light up unessecary things, we don't need all the light we use. We use lights when there are already lights ligthing up a place.																				
63	AI-XC	20131119122102	500	500	W			F	413639	11	10617230	Y	49151	This sentence relates to the author's opinion about light by pointing out that light in the world is overused.																				
64	AI-XC	20131119122102	500	500	H	N	N	F	413739	11	10617231	Y	49151	"This sentence relates to the author's opinion about light polution because he says, ""We've light up the night as if it were an occupied county."" He thinks that we use it as if it dosen't make a difference to how much we use it or where we use the lighting because we are always using it no matter where or when."																				
65	AI-XC	20131119122102	500	500	H	N	Y	F	413901	11	10617232	Y	49151	"That we try to reduce on light during the night because it makes birds ""sing at unnatural hours in the presence of artificial light."""																				
66	AI-XC	20131119122102	500	500	H	N	N	F	416285	11	10617233	Y	49151	The lights pollution effects other countrys and cities.																				
67	AI-XC	20131119122102	500	500	W	N	N	F	417219	11	10617234	Y	49151	"This sentence relates to the author's opinion about light pollution through the use of the idea relating to the fact that we are all living under the same light pollution that we've created ourselves, but it's doing nothing good for us. ""And yet above the city's pale cielings lies the rest of the universe."" We have isolated ourselves in a way that creates a barrier from what was thought the be the next closest thing."																				
68	AI-XC	20131119122102	500	500	H	N	Y	M	420484	11	10617235	Y	49151	Simple changes in lighting desgin and installation yield immediate changes in the amount of light spilled into the atmosphere and, often, immediate energy savings.																				
69	AI-XC	20131119122102	500	500	W	N	N	M	420487	11	10617236	Y	49151	light pollutions bad...m'kay.																				
70	AI-XC	20131119122102	500	500	B	N	N	M	420806	11	10617237	Y	49151	They truly made it brighter and more extravagent.																				
71	AI-XC	20131119122102	500	500	W	N	N	F	421019	11	10617238	Y	49151	"It relates because some cities are always lit up because they are a busy city. When the author says, ""Imagine walking toward London on a moonlight night around 1800, when it was Earth's most populous city."" Even though there won't be a lot of people out it is a popular city and they use light."																				
72	AI-XC	20131119122102	500	500	W	N	N	F	421927	11	10617239	Y	49151	The author is trying to explain that they lit up the night and it was unnatural. They tried to make it seem natural but it didnt work.																				
73	AI-XC	20131119122102	500	500	NR		Y	M	422333	11	10617240	Y	49151	i dont know																				
74	AI-XC	20131119122102	500	500	B	N	Y	F	423640	11	10617241	Y	49151	"I think this sentence mean, everything in the country was burned like if the country was an emptey country because of the lighte is so much powerful. In the text, the author said, ""light is a powerful biological force, and on many species it acts as a magnet, a process being studied by reseachers such as travis Longcore and Catherine rich,...Urban wildlands group."																				
75	AI-XC	20131119122102	500	500	B	N	N	F	423642	11	10617242	Y	49151	From the darkness, there was no light to see. Birds and nightsingales sang but humans couldn't see them.																				
76	AI-XC	20131119122102	500	500	NR			M	424662	11	10617243	Y	49151	"This sentence states the author's opinion that us, humans, create light pollution without thinking about where it's going, and we are ignorant to the fact that light polution in the atmosphere can be harmful to many species.  This is proven by when the author says, ""The effect is so powerful that scientists speak of songbirds and seabirds being captured by searchlights on land or by the light from gas flares on marine oil platforms, circling and circling by the thousands until they drop.""  This statement from the passage shows the author is concerned with the safety of any animals that are affected by light pollution."																				
77	AI-XC	20131119122102	500	500	H	N	Y	M	425053	11	10617244	Y	49151	"We light up the sky with street lights and other lights. We are expected to be asleep at that time, yet lights shine the streets? Some teenagers have a curfew from their parents or the law. The law wants us to be home safely, yet they are not really enforcing it. Like an ""unocupied country"", they would like to attract people to the country with their night-life. The Law wants to attract people to the night-life with their lights? Are they saying it's ok? Why do teenagers have curfews?"																				
78	AI-XC	20131119122102	500	500	H	N	N	M	425105	11	10617245	Y	49151	he hates work																				
79	AI-XC	20131119122102	500	500	W	N		F	425544	11	10617246	Y	49151	Meiner Meinung nach sagt dieser Paragraph aus, dass die Leute, die gelebt haben sehr vom Universum abheangig waren. Fuer sie war das Universum ein Hoffnungsschimmer. Es war das, wo sie die Wahrheit sehen konnten.																				
80	AI-XC	20131119122102	500	500	W	N		F	425612	11	10617247	Y	49151	We have taken over everything, from unexplored countries and seas we've been through it all. So the author is trying to us a metaphor saying the sky is like a country we are trying to fill with light.																				
81	AI-XC	20131119122102	500	500	B	N	N	M	426054	11	10617248	Y	49151	There isn't a lot of people in the country so we shouldn't use as much light, it causes pollution.																				
82	AI-XC	20131119122102	500	500	W			M	429064	11	10617249	Y	49151	The quote above is a direct representation of the author's stance in this paper. The author feels as if the human race has squandered the atmosphere and destroyed night with the use of ill-developed light fixtures. We, the human race, steady absorb and destroy resources and control the environment with little thought to the world around us.																				
83	AI-XC	20131119122102	500	500	2	N	N	F	429702	11	10617250	Y	49151	Everything is not what it seems. Lights are everywhere and they are manmade.																				
84	AI-XC	20131119122102	500	500	NR			F	431853	11	10617251	Y	49151	It related because people use light at night and thats the time it should be dark and there not saving light energy so therefore it relates to his opinion about light pollution.																				
85	AI-XC	20131119122102	500	500	NR			M	431858	11	10617252	Y	49151	I think it means they have used too much light energy.																				
86	AI-XC	20131119122102	500	500	NR			F	431912	11	10617253	Y	49151	k.																				
87	AI-XC	20131119122102	500	500	NR			M	431967	11	10617254	Y	49151	Of all the pollution we face light pollution would be one of them																				
88	AI-XC	20131119122102	500	500	NR			F	432121	11	10617255	Y	49151	epwofiwi 3																				
89	AI-XC	20131119122102	500	500	NR			M	432557	11	10617256	Y	49151	This is a tough quesstion :O																				
90	AI-XC	20131119122102	500	500	W	N	N	F	432680	11	10617257	Y	49151	That we use too much energy and he saves on light. So he uses little light which makes the country look unoccupied.																				
91	AI-XC	20131119122102	500	500	A	N	N	F	433544	11	10617258	Y	49151	"The author is saying that we use light for only our benefits forgetting that there are other living things out there that don't need the use of excess light. The author acknowledges the ""nocturnal species on the planet"" and how the midnight worl is visible enough for them with only light from the moon."																				
92	AI-XC	20131119122102	500	500	H			M	433612	11	10617259	Y	49151	The author show's how their could be alot of movement at night eith people and animals																				
93	AI-XC	20131119122102	500	500	H			F	433689	11	10617260	Y	49151	Light pollution causes many animals to become confused with what is eally going on around them.																				
94	AI-XC	20131119122102	500	500	W	N	N	F	434238	11	10617261	Y	49151	This sentence relates to the author's opinion about light pollution because it's saying how we as a society over use our light source. People turn lights on and keep them on when they don't need them. The number of lights that we use today is enough to light the entire world and nearly remove the darkness from our lives.																				
95	AI-XC	20131119122102	500	500	H			M	434252	11	10617262	Y	49151	It relates because we use light like if its nothing to us.																				
96	AI-XC	20131119122102	500	500	H	N		M	434430	11	10617263	Y	49151	I don't really enjoy this test and I do not need to take this test because it is not useful for me and for me to graduate. Another thing to do is to when one clicks pause, one should be able to save their work and be able to see it again.																				
