	AI_Prov_Name	File_Date	File_Count	Group_Count	Ethnicity	IEP	LEP	Gender	Ven_Stud_ID	Grade	Stud_Test_ID	Score_Flag	Item_ID	Item_Response	Final_Score	Data_Point	Read1_Date	Read1_ID	Read1_Score	Read1_Cond	Read2_Date	Read2_ID	Read2_Score	Read2_Cond	Read3_Date	Read3_ID	Read3_Score	Read3_Cond	Read5_Date	Read5_ID	Read5_Score	Read5_Cond	Alert_Code	Alert_ReaderID
97	AI-XC	20131119122102	500	500	NR			M	434436	11	10617264	Y	49151	Tells how its like we are trying to conquer the night and it relates to his position on light pollution because he obviously doesn't like it. Trying to convey that it shouldn't be this way and that there are other ways of doing this. One example is when he is telling that we can see the fishing lights from some charter boats from space and he thinks its ridiculous.																				
98	AI-XC	20131119122102	500	500	H	N	Y	M	434946	11	10617265	Y	49151	"This sentence goes against what Verlyn said because in the sentence it talks about how "" we've lit up the night as if it were an unoccupies country"". On the sixth paragraph of the passage Verlyn talks about birds he says, ""Migrating at night, birds are apt to collide with bightly lit tall buildings; immature birds on their first journey suffer disproportionately. This means this sentence is going against what Verlyn said because he was sticking up for the birds, and the sentence is talking about lighting up the night sky in an unoccupied country."																				
99	AI-XC	20131119122102	500	500	A	N	Y	M	435303	11	10617266	Y	49151																					
100	AI-XC	20131119122102	500	500	H	Y	Y	M	436298	11	10617267	Y	49151	from what the truth is that source of light causes light pollution.																				
101	AI-XC	20131119122102	500	500	H	N	Y	M	436343	11	10617268	Y	49151																					
102	AI-XC	20131119122102	500	500	W	N	N	M	436626	11	10617269	Y	49151	because																				
103	AI-XC	20131119122102	500	500	H	N	N	F	436978	11	10617270	Y	49151	They put alot of unescacary lights																				
104	AI-XC	20131119122102	500	500	W	N	N	M	437426	11	10617271	Y	49151	"This sentence describes how we humans are not cautious enough of our pollution and also that we're not doing a good job of preventing it either. "" and short-circuiting the human body's sensitive response to light."" This shows that because of the fact that we're not being careful, we could slowly affect our bodies from enhancing itself for the future."																				
105	AI-XC	20131119122102	500	500	W	N	N	F	437978	11	10617272	Y	49151	This sentence relates to the author's opinion about light pollution because it is saying light is being wasted.																				
106	AI-XC	20131119122102	500	500	NR			F	439269	11	10617273	Y	49151	"This sentence relates to the author's opinion about light pollution by using the words ""as if"" meaning we wasted power for a country thats not busy."																				
107	AI-XC	20131119122102	500	500	H			M	439849	11	10617274	Y	49151	that society lies to themselves about what polution is really doing																				
108	AI-XC	20131119122102	500	500	W	N	N	M	439980	11	10617275	Y	49151	the author does not like pollution																				
109	AI-XC	20131119122102	500	500	W			F	440046	11	10617276	Y	49151	i sdont know im only guessing																				
110	AI-XC	20131119122102	500	500	NR			F	442221	11	10617277	Y	49151	That they have lightened up the night that made it look like it was an unoccupied country and that the light pollution that they have brought to the planets. That light is a powerful biological force that many species act to it as a magnet.																				
111	AI-XC	20131119122102	500	500	B	N	N	M	442632	11	10617278	Y	49151	MOM																				
112	AI-XC	20131119122102	500	500	W	N	N	F	444801	11	10617279	Y	49151	"""Among mammals alone, the number of nocturnal species is astonishing.""(paragraph 6) The author states that the nocturnal species level is astonishing, would that be a lower or higher number? With all the lights and energy we give off in our cities we make the night time seem as if it were the day time, which causes night time animals to not be night time but day time like every other mammal on the planet. When we light up the night like ""an un-occupied counrty"", which we do every night, because the nocturnal mammals own the night, we take away the daily schedules of other mammals."																				
113	AI-XC	20131119122102	500	500	B			M	445081	11	10617280	Y	49151	We are causing many problems as if we did'nt know better.																				
114	AI-XC	20131119122102	500	500	B			M	445082	11	10617281	Y	49151	"People lit up the country affecting animals and the environment not knowing their messing up other life forms as it states""frogs and toads living near brightly lit highways suffer nocturnal light levels, throwing nearly every aspect of their behavior out of joint, including their nighttime breeding choruses."																				
115	AI-XC	20131119122102	500	500	NR			F	445234	11	10617282	Y	49151	"The author believe that light polution is something to be reduced, so saying the night is an unoccupied country shows the human desire to emperialize what is not theirs and ultimately make it their own. However, with the examples of nocturnal animals, the author conveys that the night is not unoccupied, that it is shared by everyone on the planet, including animals. By ""lighting the night,"" we infringe on their right to also occupy the night."																				
116	AI-XC	20131119122102	500	500	W	N	N	F	445486	11	10617283	Y	49151	It relates to the point that we are using to much light and causing a lot of light pollution, because we fear the darkness.																				
117	AI-XC	20131119122102	500	500	NR			M	446087	11	10617284	Y	49151	The author talks about the many types of nocturnal species that live in the darkness. This sentence suggests that the darkness is indeed an occupied country, and we are invading it. The author believes that the darkness, and all who live in it, are extremely important to not only the environment, but to humans as well.																				
118	AI-XC	20131119122102	500	500	NR			M	446137	11	10617285	Y	49151	they mean by lighting up people on how much pollution is going around the world and showing them how they can help by stoping it.																				
119	AI-XC	20131119122102	500	500	NR			F	446330	11	10617286	Y	49151	This sentence relates to the author's opinion about light pollution because as he said we lit up the night as if it were an unoccupied county when nothing could be further from the truth, he has a point we dont need all this light during the night. In the 1800s london didnt have much light yet many people were out at night because it was a very beautiful city and they didnt need all that light pollution just to make the city stand out.																				
120	AI-XC	20131119122102	500	500	NR			M	446448	11	10617287	Y	49151	no																				
121	AI-XC	20131119122102	500	500	NR			M	447153	11	10617288	Y	49151	"This line shows how much the humans have lighten up the night sky. just as the text says we have, ""eyes adapted to living in the sun's light"". We are expecting the light and we barely notice its effects on us. It's the truth that we oeruse it, but we have come so dependent on it, we won't find a solution."																				
122	AI-XC	20131119122102	500	500	NR			M	447219	11	10617289	Y	49151	there saying that we damaged the earth. that we came over and destoyred the earth.																				
123	AI-XC	20131119122102	500	500	W	N	N	M	447262	11	10617290	Y	49151	"The author does not like this pollution. While he says ""If humans were truly at home under the light of the moon and stars, we would go in darkness happily, the midnight worlds as visible to us as it is to the vast number of nocturnal species on this planet"". He means that night is more beautiful when there are not lights ruining the sky."																				
124	AI-XC	20131119122102	500	500	W	N	N	F	447710	11	10617291	Y	49151	Our light pollution is not only affecting us, but other species as well. For example, it disrupts migration cycles for some species of birds.																				
125	AI-XC	20131119122102	500	500	W	N	N	M	447819	11	10617292	Y	49151	This sentence relates to their opinion because it states that we waste a lot of energy and we are not using it as efficiently as we could be by improving our lighting systems to prevent unwanted light shining outward and upward into the sky.																				
126	AI-XC	20131119122102	500	500	W	N	N	F	449433	11	10617293	Y	49151	All of our lights affect the night time and make it lighter than it should be because of the light polution, which is bad and we shouldn't be doing																				
127	AI-XC	20131119122102	500	500	NR			F	449588	11	10617294	Y	49151	This sentence relates to the author's opinion about light pollution because it's relating how we are lighting up the world as if we were lighting up an unknown place, an unoccupied country. The author has stated before that light acts as a magnet and attracts many species. Lighting up an unoccupied country and having much light pollution from there would attract species of all kinds from mammals to sea creatures.																				
128	AI-XC	20131119122102	500	500	NR			F	449589	11	10617295	Y	49151	Author is talking about how at night there is alot of lights that are in use that really don't have no use on being on like for example casinos, they dont need all that lighting on there billboards or in there name tiles they just use all that lighting to capture tourist and peoples attention for they can have intrest and go there. Another is that it is bad for creatures that live the night life, like for us humans we use the daylight to go to school and plenty use it to go to work we use the night time only to go to sleep and get some rest. Creatures use the dark for many thing like turtles, turtles use the night dark skies to lay out there eggs in the sand.Like how the article says, less and less turtles come out to lay there eggs because they see lights brighter and closer and rather not go there to lay eggs so you see less and less turtles laying eggs.																				
129	AI-XC	20131119122102	500	500	NR			F	449590	11	10617296	Y	49151	This sentence relates to the author's opinion about light pollution by saying that humans are the reason why there is light pollution.																				
130	AI-XC	20131119122102	500	500	W			F	449746	11	10617297	Y	49151	many people use light to see things but what they dont know is its causing light pollution. when we have a lot of light shining it affects everything around us such as life, migration, and a lot of other things.																				
131	AI-XC	20131119122102	500	500	W			M	449747	11	10617298	Y	49151	"This is best exemplified in his speaking of how light polution affects animals. We are not ""an Unocupied country"" that has the risth to polute, using light, and affect others."																				
132	AI-XC	20131119122102	500	500	B	N		F	449751	11	10617299	Y	49151	"This sentrnce relates to the authors opinion because it shows that we us light twenty four seven , meaning when the author writes """																				
133	AI-XC	20131119122102	500	500	B	N		F	449752	11	10617300	Y	49151	scientitsts think that it is a bad idea to had a lot of lights on outside at night time, they say the designed lighting washes out the darkness of night and radically alters the light levels. light population is largely the resault of bad lighting design,which allows artificial light to shine outward and upward into the sky, where its not wanted.																				
134	AI-XC	20131119122102	500	500	H	N	Y	M	449776	11	10617301	Y	49151	The people doesn't care about light pollution because it will never effect them, but it can effect thier children in the future.																				
135	AI-XC	20131119122102	500	500	H	N	Y	M	450182	11	10617302	Y	49151	okay.																				
136	AI-XC	20131119122102	500	500	B	N	N	M	450231	11	10617303	Y	49151	it relates in a srong way.																				
137	AI-XC	20131119122102	500	500	NR	N	N	F	450443	11	10617304	Y	49151	that the lights brightened the night sky cause they were over poppulated																				
138	AI-XC	20131119122102	500	500	H	N	N	M	451370	11	10617305	Y	49151	saying how you can make something out of nothing																				
139	AI-XC	20131119122102	500	500	H	N	N	M	452893	11	10617306	Y	49151	its relates to the fact that we we use light as if we were the only country using , when infact we use so much light that you can see it in space																				
140	AI-XC	20131119122102	500	500	W	N	N	F	453037	11	10617307	Y	49151	This sentence relates to the authors opinion about light pollution because it refers to the invasion we have placed on the night time darkness.  We do not care about the night being its own time and place so we are invading it with the light from our lives.  In the passage the author reflects on the number of nocturnal species on earth and this is what she means by night being another country.  The night is the country of the nocturnal and we may think it is unoccupied but we are wrong.																				
141	AI-XC	20131119122102	500	500	W	N	N	F	454702	11	10617308	Y	49151	This sentence is saying that over ninety nine percent of the world is pretty much made up of lights and we 'humans' are looking for even more space to light up because WE CAN, unfortunately.																				
142	AI-XC	20131119122102	500	500	W	N	N	F	457966	11	10617309	Y	49151	The author uses this piece to help because it shows that the amount of light we are using is going to waste.  The light we use is uneccesary. For example, when she says the squid fishers use more light than Rio, this is showing the amount of light going to waste to hunt squids.																				
143	AI-XC	20131119122102	500	500	W	N		F	459692	11	10617310	Y	49151	Light pollution affects more than humans. The sky is not unoccuppied territory. The birds that try to migrate our affected by the light pollution of the sky. The texts says that migrating birds are apt to collide with brightly lit tall buildings.																				
144	AI-XC	20131119122102	500	500	H	N	N	F	466721	11	10617311	Y	49151	we as people use so much light at night that we make ourselves a unoccupied country.(ex)Darkness is an essential																				
145	AI-XC	20131119122102	500	500	H	N	Y	M	466779	11	10617312	Y	49151	I believe that using up more light than what is needed is unneccessary.																				
146	AI-XC	20131119122102	500	500	W	N	N	F	468132	11	10617313	Y	49151	"The author believes that people are unaware or uncaring about light pollution. They are uncomfortable with the darkness of the night, so they choose to light it, heedless of the damage it does to the natural environment and nocturnal creatures. In the same paragraph he states, ""Among mammals alone, the number of nocturnal species is astonishing. Light is a powerful biological force, and on many species it acts as a magnet..."" He is concerned about light pollution's effect on the nocturnal population."																				
147	AI-XC	20131119122102	500	500	W	N	N	M	469471	11	10617314	Y	49151	Comes to show that us humans do not understand what we are doing when using light. i've found out that thr smallest amount of light could or would cause a lightning pollution.																				
148	AI-XC	20131119122102	500	500	H	N	N	M	469472	11	10617315	Y	49151	"By saying ""lit up the night"" means that the sky has been polluted."																				
149	AI-XC	20131119122102	500	500	H	N	N	F	469473	11	10617316	Y	49151	"""  We've lit up the night as if it were an unoccupied country""meaning anyone can cause pollution but no'one annouces how to make a change."																				
150	AI-XC	20131119122102	500	500	NR	N		F	470200	11	10617317	Y	49151	It shows that the author does not like light pollution by saying that we've taken over the night when it wasn't ours to take over in the first place.																				
151	AI-XC	20131119122102	500	500	NR	N		F	470240	11	10617318	Y	49151	"He is saying that lighting up evey city makes it look like we are not even there. Saying that were always there. When he says "" when nothing could be further from the truth"" he means that we use light as if we live for it. and that we act like were not even there and were still using the light too much when at night noone is awake to even see it."																				
152	AI-XC	20131119122102	500	500	A	N	N	F	470448	11	10617319	Y	49151	The senetence above relates to the author's opinion by stating how they light up the night as if it's a big city when its really not.																				
153	AI-XC	20131119122102	500	500	W	N	N	F	470457	11	10617320	Y	49151	This sentence relates to the author's opinion about light pollution by stating we have made the nighttime brighter as if we went to an empty land and started up life, and this is proven by stating how there are tons of nocturnal animals because we have awaken a revolution of animals to be aware at night because it is still bright outside.																				
154	AI-XC	20131119122102	500	500	H	N	N	F	471489	11	10617321	Y	49151	This sentence relates to the author's opinion about light pollution because he argues that it's our fault, we have lit up this place on our command. And, we have lit up this world like if it were ours to do so. We have lit up this place like the fisherman lighting up the ocean with his small light.																				
155	AI-XC	20131119122102	500	500	H	N	N	F	472081	11	10617322	Y	49151	This sentence relates to the author's opinion about light pollution because it says that humans take over the darkness of the night with their lights.Humans take advantage of the night because the darkness is not a living organism and therfore it cant do anything just like an unoccupied country.																				
156	AI-XC	20131119122102	500	500	H	N	Y	M	472130	11	10617323	Y	49151	It is saying that they made light where there was none.																				
157	AI-XC	20131119122102	500	500	W	N	N	M	472238	11	10617324	Y	49151	"This sentence relates to the author's opinion by telling us how the light population is effecting the world  and the animals that live in the world. For example in paragraph six it says: ""Among mammals alone, the number of nocturna; species is astonishing. Light is a powerful biological force, and on many species it acts as a magnet..."" Therefore, it explains on how this is effecting the life of animals and the earth."																				
158	AI-XC	20131119122102	500	500	H	N	N	M	472332	11	10617325	Y	49151	you have nothing to worry about just have fun																				
159	AI-XC	20131119122102	500	500	NR			F	472863	11	10617326	Y	49151	"Humanity has taken advantage of light and the avalibility of light to large measures. The author believes that it has taken advantage of this ablility to the point where we have over-populated the skies with our artificial lights. Many biological issues among different spieces such as some birds who, ""sing at unnatural hours in the presence of artificial light"" and sea turtles and ""their hatchlings, which gravitate toward the brighter, more relective horizion, ind themselves confused by artificial lighting behind the beach."" These problems in other animals have a correlation with humanities over use of light. Looking back on the quote provided and the second part of the sentence, that unoccupied country may have some form of life."																				
160	AI-XC	20131119122102	500	500	W	N	N	M	473406	11	10617327	Y	49151	This sentence relates to the author's opinion by showing what he thinks of light pollution and how we should change.  He says that it is so harmful to our bodies and that it is not natural for us.																				
161	AI-XC	20131119122102	500	500	A			F	473651	11	10617328	Y	49151	"The author's believes that light pollution is a serious problem and no one really knows or cares about it. In the quote given, it explains that the light we're using was unknowingly bad for us and our environment. Humans need darkness and with all this light pollution, it's affecting everyones growth, from animals to humans. ""Wherever human light spills into the natural world, some aspect of life-- migration, reproducion, feeding -- is affected."" This really explains how light pollution is a bad problem for society and there are small changes we can do to fix this problem."																				
162	AI-XC	20131119122102	500	500	W	N	N	F	474140	11	10617329	Y	49151	An unoccupied country should stay dark at night.																				
163	AI-XC	20131119122102	500	500	B	N	N	F	474214	11	10617330	Y	49151	It is alot of light population because their are alot of people in the world and they are over using energy.																				
164	AI-XC	20131119122102	500	500	H	N	Y	F	474217	11	10617331	Y	49151	Lit up at night																				
165	AI-XC	20131119122102	500	500	H	N	N	F	474270	11	10617332	Y	49151	The sentence helps to show how the author feels that humanity's excessive use of light is unnecessary.																				
166	AI-XC	20131119122102	500	500	H	N	N	F	475314	11	10617333	Y	49151	"The author's opinion insights that we've ""conquered"" the night with light as one might an unoccupied country, however the comparision is completley false. The night is to remain dark because it has nocturnal occupants whom can't live with articial light interupting their natural cycle, ""throwing nearly every aspect of their behavior our of joint""."																				
167	AI-XC	20131119122102	500	500	W	N	N	M	475723	11	10617334	Y	49151	"This sentence relates to the author's opinion about light polution, because the author is trying to say that light pollution ""spills into the natural world"" and is uneccesary because we do not need to see into the night sky."																				
168	AI-XC	20131119122102	500	500	H	N	N	M	475899	11	10617335	Y	49151	The author explains how the country is being light polluted by the excessive use of light in the world that is affecting everything around them.																				
169	AI-XC	20131119122102	500	500	H	N	N	M	475903	11	10617336	Y	49151	i think the author is trying to prove that light is sucking the joy out of night																				
170	AI-XC	20131119122102	500	500	H	N	N	M	476458	11	10617337	Y	49151	What this passage means is that we use lights to make ourselves feel good, without realizing the problems that go with it.																				
171	AI-XC	20131119122102	500	500	W	N		M	478062	11	10617338	Y	49151	We are trying to hard to extend the days and shorten the night. The consequences of the bright world to come are gunna effect the lower end creatures, yet we as human can receive consequences as well.																				
172	AI-XC	20131119122102	500	500	B	N	N	F	481046	11	10617339	Y	49151	N/A																				
173	AI-XC	20131119122102	500	500	NR			M	481942	11	10617340	Y	49151	that we use to much light																				
174	AI-XC	20131119122102	500	500	A	N	N	M	482652	11	10617341	Y	49151	hes saying the night is much more than what we portray it as																				
175	AI-XC	20131119122102	500	500	H	N	N	F	482681	11	10617342	Y	49151	This sentence explains the authors opinion by putting emphasis on what the speaker was talking about.																				
176	AI-XC	20131119122102	500	500	W	N	N	M	482934	11	10617343	Y	49151	The quality of life is greatly reduced by taking tests online rather than on paper.																				
177	AI-XC	20131119122102	500	500	W	N	N	M	482942	11	10617344	Y	49151	The author's opinion about light pollution is very close to the sentance. If they lit up the sky like an unoccupied counrty there would be little light needed.																				
178	AI-XC	20131119122102	500	500	W	N	N	M	483074	11	10617345	Y	49151	I'm not really sure what he means here, the unoccupied country thing doesn't make sense to me.																				
179	AI-XC	20131119122102	500	500	W	N	N	M	483080	11	10617346	Y	49151	we use so much light around the world that we have lit up the night as the author has said																				
180	AI-XC	20131119122102	500	500	W	N	N	F	483086	11	10617347	Y	49151	I got nothing..																				
181	AI-XC	20131119122102	500	500	H	N	Y	F	484577	11	10617348	Y	49151	This sentence relates to the author's opinion about light pollution because the author states that light pollution can empty our sky of stars. We make our days longer with artifical light, and our nights shorter. Light serves as a blanket over the stars, and it prevents us from seeing beyond space.																				
182	AI-XC	20131119122102	500	500	H	N	Y	F	484598	11	10617349	Y	49151	we just use too much light.  We want to have everything on and that is just making our environment worse.																				
183	AI-XC	20131119122102	500	500	H	N	Y	M	484634	11	10617350	Y	49151	Light pollution can cause some enviromental problems. For example, our ozone layer is being affected by all the pollution we humans give off from today's modern technology. There is way more Carbon dioxide now than there was 20 or 30 years ago from today.It's a good thing car makers are changing the way cars get their energy source from and starting to make more hybrids on the road, and cheaper to buy too.																				
184	AI-XC	20131119122102	500	500	B	N	N	F	487046	11	10617351	Y	49151	"As stated in the reading ""light is a powerful biological force, and on many species it acts as a magnet""."																				
185	AI-XC	20131119122102	500	500	W		N	M	487282	11	10617352	Y	49151	Author does not like pollution similarly to the paragraph above.																				
186	AI-XC	20131119122102	500	500	W		N	M	487289	11	10617353	Y	49151	The Author fel stongly about pollution in the air.																				
