	AI_Prov_Name	File_Date	File_Count	Group_Count	Ethnicity	IEP	LEP	Gender	Ven_Stud_ID	Grade	Stud_Test_ID	Score_Flag	Item_ID	Item_Response	Final_Score	Data_Point	Read1_Date	Read1_ID	Read1_Score	Read1_Cond	Read2_Date	Read2_ID	Read2_Score	Read2_Cond	Read3_Date	Read3_ID	Read3_Score	Read3_Cond	Read5_Date	Read5_ID	Read5_Score	Read5_Cond	Alert_Code	Alert_ReaderID
366	AI-XC	20131119122102	500	500	B	N	N	M	604342	11	10617533	Y	49151	This relates to the authors opinion about light pollution because that is not good for the earth by us lighting up the night.																				
367	AI-XC	20131119122102	500	500	H	N	Y	F	604499	11	10617534	Y	49151	Of all the pollution we aface, light pollution is perhaps the most easily remedied. Simple changes in lighting design and installation yield immediate changes in the amount of light spilled into the atmosphereand often immediate energy saving.																				
368	AI-XC	20131119122102	500	500	H	N	N	M	604584	11	10617535	Y	49151	"All the light pollution has caused the stars to not be seen as much during the night time. For example,""In most cities the sky looks as though it has veen emptied of stars, leavng behind a vacant haze that mirrors our far of the dark and resembles the urvan glow of dystopian science fiction."""																				
369	AI-XC	20131119122102	500	500	NR			F	604829	11	10617536	Y	49151	Humans use light when it is not needed cause at night we already have light. We have the moon and stars and some of the people dont think it is good enough.																				
370	AI-XC	20131119122102	500	500	NR			M	606484	11	10617537	Y	49151	"This author doesnt believe that its like we hvent been here because there are so many lights that are always on, causing light pollution. The author says ""we would go in darkness happily"" if we did that that we would look like an unoccupied country."																				
371	AI-XC	20131119122102	500	500	NR			F	609020	11	10617538	Y	49151	"The sentence relates to the author's opinion about light polluiton. It tells how us as a country is using too much light and how it affect the world. It shows how we use most of it as waste and shouldn't. How it is chaniging the world around us. For example ""For the past century or so, we've beem performing an open-ended experiment on ourseleves, extending the day. shortening the night, and short-circuiting the human's body senitive response to light."" That tells how over the years the people have change the world and not in a good way."																				
372	AI-XC	20131119122102	500	500	NR			M	609111	11	10617539	Y	49151	The lighting up the night as if it were an unoccupied country means, in my opinion at least, that the world feels that it is necessary for lights to be constantly on throughout the night. They think that think that nothing can be affected by it, as if there was almost nothing there. The truth is, from this article at least, that there are thousands of species including humans that are harmfully affected by 'lighting up the night'.																				
373	AI-XC	20131119122102	500	500	NR			M	609162	11	10617540	Y	49151	The reason that this sentence relates to the authors oinion on light pollution would is because the reader suggests that light needs to be aimed towards the ground where it is supposed to be and not up at the sky which makes it so that nobody can see the night sky.																				
374	AI-XC	20131119122102	500	500	NR			F	609877	11	10617541	Y	49151	That pollution is bad for the environment. And very unhealthy for people and animals and plants.																				
375	AI-XC	20131119122102	500	500	H			M	611292	11	10617542	Y	49151	"in the night people reayher being at home safe that being aoutside in the darkness alone ""we are diurnal creatures..."""																				
376	AI-XC	20131119122102	500	500	W	N	N	F	611600	11	10617543	Y	49151	This relates to the author because the reader whould understand that cities are not the main source of light.																				
377	AI-XC	20131119122102	500	500	H			M	611837	11	10617544	Y	49151	"The author states that the light creates a ""roof"" in which we are hidden from the vast universe."																				
378	AI-XC	20131119122102	500	500	W	N	N	F	612182	11	10617545	Y	49151	The author believes that humans forget we are not the only creatures on earth and that what we do (such as create artifical daylight) has no affect on any one but us, however; we are not the only wanders of the earth. The author points out that even amoung our fellow mammals, there is a large number of nocturnal speices, who need the night and are harmed by our light pollution.																				
379	AI-XC	20131119122102	500	500	H	N	N	F	615137	11	10617546	Y	49151	i have no clue.																				
380	AI-XC	20131119122102	500	500	2	N	N	F	615779	11	10617547	Y	49151	"The lights lit the whole city light. For example the passage saids, ""we've lit up the night"""																				
381	AI-XC	20131119122102	500	500	NR			F	616459	11	10617548	Y	49151	this supports the authors opinion by saying we use just as much polution during thhe day as we do at night.																				
382	AI-XC	20131119122102	500	500	NR			M	616505	11	10617549	Y	49151	Of all the pollutions we face, light pollution is perhaps the most easily remedied. From this sentence we knew that the light pollution could be remedied easily so people just think it does not matter,then they just lit up the nigh whenever they want.																				
383	AI-XC	20131119122102	500	500	H	N	N	F	617251	11	10617550	Y	49151	We Use light for mpst time peiord																				
384	AI-XC	20131119122102	500	500	NR			F	618358	11	10617551	Y	49151	"This relates to the author's opinion on pollution because it talks about how we are extending light into the night when night is important as well.  If we didn't do this there wouldn't be light pollution.  This is the author's opinion as seen in the last line of the introductory paragraph where they state in talking about the light that we have ""engineered it to receive us by filling it with light."""																				
385	AI-XC	20131119122102	500	500	NR			F	618359	11	10617552	Y	49151	"author thinks that light pollution affects every species on the planet, and that humans, when doing things that benefit them (such as illuminating the darkness) act as though their actions only affect themselves. ""Migrating at night, birds are apt to collide with brightly lit tall buildings; immature birds on their first journey suffer disproportionately."" - shows how certain creatures are affected by the night being lit up and how the night is not an unoccupied country."																				
386	AI-XC	20131119122102	500	500	NR			M	620754	11	10617553	Y	49151	Light polution makes us look like thier is nothing here just a large lit up spot. But were not we are many people who just waits electrisity and light up the world.																				
387	AI-XC	20131119122102	500	500	NR			M	621826	11	10617554	Y	49151																					
388	AI-XC	20131119122102	500	500	H	N	N	F	622404	11	10617555	Y	49151	We use light without even thinking, without even thinking of the fact that we have natural light already. We do not think about the harm that we can be doing to ourselves and our planet. Our minds reject organic light because we're so used to our arificial light. Naturally, us 'earthlings' are selfish and do not think about the consequences to our actions. There are other people and things that get harmed by every decision we make, and we need to start thinking about all of those things instead of being selfish.																				
389	AI-XC	20131119122102	500	500	NR	Y		M	624027	11	10617556	Y	49151	Well sents we are useing mrekary lights to light up evert thing from our homes to out streetsthere is going to be light pollution. So if we could go and make a better light well then we would not have to worry about it.																				
390	AI-XC	20131119122102	500	500	NR			F	624031	11	10617557	Y	49151	in my opinion, the reader would understand that lights are in everywhere																				
391	AI-XC	20131119122102	500	500	W			M	624318	11	10617558	Y	49151	"The author is trying to portray that animals lived here before we did, ""migrating at night, birds are apt to collidewith brightly lit tall buildings.."" we are affecting the birds migration."																				
392	AI-XC	20131119122102	500	500	NR			F	624338	11	10617559	Y	49151	It explains it very well																				
393	AI-XC	20131119122102	500	500	NR			F	624343	11	10617560	Y	49151	da dada dadada dadada																				
394	AI-XC	20131119122102	500	500	H			M	624420	11	10617561	Y	49151	This means that we have come and used our technology to abuse the natural state of when there should be light and when there shouldent and by doing this we are polluting the earth with light.																				
395	AI-XC	20131119122102	500	500	NR			M	624475	11	10617562	Y	49151	That the light we are spilling out into the earth is harming all the animals and other species of the wild.																				
396	AI-XC	20131119122102	500	500	NR			F	624476	11	10617563	Y	49151	its saying that people use light just because we can.  In the story said how people would just leave lights on, its causing light pollution beacause we dont need it.																				
397	AI-XC	20131119122102	500	500	H	N	N	F	624772	11	10617564	Y	49151	"This sentence relates to the author's opinion about light pollution in that it states that we use up a great amount of light. The author uses a simile to relate to his main idea, ""We've lit up the night as if it were an unoccupied country"". It is THIS drastic and big of a deal how much light we use up."																				
398	AI-XC	20131119122102	500	500	NR			M	624990	11	10617565	Y	49151	The light pollution around these days a lot of people used them for brightness. Light population wasn't mentioned as much before even now in the present because most people think it made sense.																				
399	AI-XC	20131119122102	500	500	NR			F	624991	11	10617566	Y	49151	"It shows that the people dont really care of the enviroment and they just keep waisting energy. Every night they keep lighting up lights so it wont be so dark. They could just enjoy the light that the moon gives them, instead of using all this light at night. Using light can be hurting our enviroment. It the text it says that, ""light is a powerful force and on many species it acts as a magnet..."" This means that light can effect in many ways and that maybe people should stop using so much light at night."																				
400	AI-XC	20131119122102	500	500	NR			F	624996	11	10617567	Y	49151	The author comments that us humans have lit up the country to the point where animals are being greatly impacted. Due to our carelessness, others besides ourselves are being affected biologically.																				
401	AI-XC	20131119122102	500	500	NR			M	624998	11	10617568	Y	49151	the authors saying that were abusing our light powers, we use to much of it and were ruining something thats even more amazing then seeing our yard lit up in the middle of the night. Nothing would be as amazing as to see the sky in its natural state.																				
402	AI-XC	20131119122102	500	500	NR			F	624999	11	10617569	Y	49151	"In the eyes of the author, light pollution is a human fault that affects the lives of all living things on the planet. Because of the fact that humans are creating an long artificial daytime and a short artificial nighttime, many other mammals are adapting to this new schedule. Some birds now sing at unnatural hours because of the presence of artificial light, and this also induces a longer feeding, which affects their migration schedules. Leaving too early for their migration can mean arriving too soon for their nesting conditions to be right. Bright buildings can cause migrating birds that travel at night to collide with them, causing some immature birds to suffer disproportionately. Even nesting sea turtles can be affected; They show a natural predisposition for dark beaches, but are confused by the artificial lighting behind the beach. Frogs and toads that live near brightly lit highways do ""suffer nocturnal light levels that are as much as a million times brighter than normal"" which affects their behaviors and breeding choruses. What the author is trying to say is that we have invaded the night, and it is not ours to control. We think of nighttime as a place for us to change and make our own, but this is untrue; Other mammals depend on the night and night is theirs as much as it is ours."																				
403	AI-XC	20131119122102	500	500	H	N	Y	F	625231	11	10617570	Y	49151	We use light to light up the days																				
404	AI-XC	20131119122102	500	500	NR			F	625440	11	10617571	Y	49151	"This sentence is explaining how we don't see the real beauty during night time because the lights take away from it. For example, in the passage he stated ""In most cities the sky looks as though it has been emptied of stars, leaving behind a vacant haze that mirrors our fear of the dark and resembles the urban glow of dystopian science finction."""																				
405	AI-XC	20131119122102	500	500	W	N	N	M	625767	11	10617572	Y	49151	In the sentence above it relates to light pollution by saying that the population uses so much light that the sky the habitat for many speices is so bright that birds are apt to collide with brightly lit tall buildings.																				
406	AI-XC	20131119122102	500	500	W	N	N	M	626918	11	10617573	Y	49151	Only a few houses were lit by gas,and there wouldbe no public gaslights in the streets or squares for another seven years.																				
407	AI-XC	20131119122102	500	500	W		N	M	627165	11	10617574	Y	49151	This sentance relates to the author's opinion because its showing that for no reason, we are using light and it is harming the environment.  There is alot of energy used in order to power light bulbs, and it is easy to fix but no one wants to do it.  The author mentions that it can be fixed and lower the amount of light polution.																				
408	AI-XC	20131119122102	500	500	B		N	M	627166	11	10617575	Y	49151	"The author does care about pollution because ""for the past cebturyor so, we've been performing an open-ended experiment on ourselves, extending the day, shortening the night.''"																				
409	AI-XC	20131119122102	500	500	W	N	N	M	628464	11	10617576	Y	49151	First off, I want to say that this test is horrible.   But as for the actual question, I think this sentence relates to the authors opinion because he is making a point of how much light we are wasting, enough to lighten an entire country. The quote can be foung in the passage, 'Our Vanishing Night'.																				
410	AI-XC	20131119122102	500	500	W	N	N	F	629895	11	10617577	Y	49151	The author is saying we shouldn't be using so much light at night because it disturbs the natural order of things.																				
411	AI-XC	20131119122102	500	500	W	Y	N	M	630013	11	10617578	Y	49151	He's talking about the engineering and how its so differnt from the past and that they use damming the river as their resource.																				
412	AI-XC	20131119122102	500	500	W	N	N	M	631831	11	10617579	Y	49151	"The sentence is saying that we act as if humans alone own this Earth and that we need to remember that there are other living things on this planet that need the darkness just as much as we do. Just like when they said that ""Among mammals alone the number of nocturnal species is astonishing."" which shows how some animals are affected by these shortened days."																				
413	AI-XC	20131119122102	500	500	W	N		F	634716	11	10617580	Y	49151	This sentence relates to the authors opinion about light pollution by saying that we waste so much light that it could light up an unoccupied country. We need darkness to keep the world working properly.																				
414	AI-XC	20131119122102	500	500	W	N		M	634717	11	10617581	Y	49151	It shows that the auther believes the night sky is an important plasce or thing for many things to occer. The auther supports this claim by providing examples of animals lives being disrupted.																				
415	AI-XC	20131119122102	500	500	W	N		M	634720	11	10617582	Y	49151	During the night, countries have been lighting up there towns and cities and not thinking about how much light pollution they may be giving off just in a short amount of time. Not as many people may be moving during the night but the lights make it seem that there is an abundance of them moving about.																				
416	AI-XC	20131119122102	500	500	W	N	N	M	635745	11	10617583	Y	49151	"The sentence relates to the author's opinion about light pollution is that human do not stop using light.""For the past century or so, we've been perforning an open ended-experiment on ourselves, extending the day, shortening the night, and short-circuiting the human body's sensitive response to light."""																				
417	AI-XC	20131119122102	500	500	B	N	N	F	636583	11	10617584	Y	49151	the author point of veiw about this is that the light is powerful and good for the using .the opinion is that the pollution is bad for the mammals and humans and species.																				
418	AI-XC	20131119122102	500	500	W	N	N	M	636815	11	10617585	Y	49151	The text says that there are many nocturnal species, even just counting mammals.  The author thinks that light pollution is bad for nocturnal animals.  This sentence articulates his opinion that humans are oblivious to the fact that light pollution can kill animals.  The author goes on to talk about how this can be easily remedied.																				
419	AI-XC	20131119122102	500	500	B			M	638264	11	10617586	Y	49151	without thomas eddison creation there would be no light																				
420	AI-XC	20131119122102	500	500	B			F	638265	11	10617587	Y	49151	It relates to the passage because it talking about light pollution.																				
421	AI-XC	20131119122102	500	500	B			F	638269	11	10617588	Y	49151	.																				
422	AI-XC	20131119122102	500	500	W			M	638270	11	10617589	Y	49151	Deeznutz																				
423	AI-XC	20131119122102	500	500	H	N	N	M	641169	11	10617590	Y	49151	The fact of light becoming harnessed for the mere enjoyment or sheer prospering of one's life.This causing a horrific toll on the planet and its inhabitants, Such as the frogs and toads living near brightly lit highways.																				
424	AI-XC	20131119122102	500	500	H	N	N	M	641691	11	10617591	Y	49151	"The author believes that light pollution affects the night, and that humanity has been causing much light pollution. In paragraph one of ""Our Vanishing Night,"" Klinkenborg shows us that we as ""diurnal creatures,"" do not like night and claims that we use light poullution to fit our needs by stating that, ""we've engineered [night] to receive us by filling it with light."""																				
425	AI-XC	20131119122102	500	500	H	N	Y	M	641693	11	10617592	Y	49151	people waste energy unneeded																				
426	AI-XC	20131119122102	500	500	W	N	N	F	642184	11	10617593	Y	49151	The author thinks air pollution is a bad thing.																				
427	AI-XC	20131119122102	500	500	NR	N		M	643647	11	10617594	Y	49151	"The author believes that the nocturnal species should not be subjected to our excessive usage of light during the night. It affects their ability to get through the night. Light does help us through the night, but ""its benefits come with consequences""."																				
428	AI-XC	20131119122102	500	500	NR	N		F	643691	11	10617595	Y	49151	He doesn't like that peopl act as though the ligh doesn't affect the life around us. In the text it talks about the affect of light on the birds behaviors.																				
429	AI-XC	20131119122102	500	500	NR	N		F	643692	11	10617596	Y	49151	I believe when it says that part, that when it's dark outside, we always end up finding a light source if needed anyways. It's not too big of a deal, for dark because most people would be sleeping. For the ones who work at night, they usually are inside working, or find their own light source while working.																				
430	AI-XC	20131119122102	500	500	NR			F	647013	11	10617597	Y	49151	This sentence is saying that in that night they lit up the air like it had never been lit before but then the author says that he knows that isn't the truth. So he's saying that people use light all the time and there is always light polluting the air, but for that one night it felt like he was lighting up the world.																				
431	AI-XC	20131119122102	500	500	H			F	647314	11	10617598	Y	49151	At night time we light up all the lights without knowing the polution it creats.																				
432	AI-XC	20131119122102	500	500	H	N	N	M	647415	11	10617599	Y	49151	"This sentence relates to the author's opinion on lights because the author believes light is bad and is bad for the earth. ""yet it's the only way to explain what we've done to the night: we've engineered it to recieve us by filling it with light."""																				
433	AI-XC	20131119122102	500	500	W			M	648465	11	10617600	Y	49151	human error we polute things																				
434	AI-XC	20131119122102	500	500	H		N	M	648902	11	10617601	Y	49151	This shows how night is now lit up, as if it were daytime. This means that there are few chances to look up into space to discover new things. The author also talks about how the sky looks as if it were emptied of stars, and this is because of the night light of the earth.																				
435	AI-XC	20131119122102	500	500	W	N	N	F	650642	11	10617602	Y	49151	This relates to the Authors opinion about light pollution beacuse, its says nothing is further from the truth meaning that they wont get a answer worse than the truth.																				
436	AI-XC	20131119122102	500	500	B	N	N	F	651272	11	10617603	Y	49151	it relates to the author point because, the author is talking about the night skys and in this sentence its talking about how the night be lit like and occupied country.																				
437	AI-XC	20131119122102	500	500	NR			F	651783	11	10617604	Y	49151	The author believe that humans use so much unnecessary light on earth. Because of this, it has hurt many things. For example, birds collide with brightly tall buildings during migration at night. It can cause them to suffer and die.																				
438	AI-XC	20131119122102	500	500	W	N	N	M	652011	11	10617605	Y	49151	This sentence relates to the authors opinion because it talkes about how all the light that we use at night is causing a growth is the pollution.																				
439	AI-XC	20131119122102	500	500	B	N	N	F	655994	11	10617606	Y	49151	"This sentence relates  to the author's opinion about light pollution because in the text he says, "" For most of human history, the phrase light pollution would have made no sense."""																				
440	AI-XC	20131119122102	500	500	H	N	Y	F	658218	11	10617607	Y	49151	"The sentence above relates to the author's opinion about light pollution by teling us that lights have been set up around the country as if the country was empty. She tells us how birds in the night time are being attracted by ""lit tal buildings"" but, how immature birds are having a difficult time with the lighting."																				
441	AI-XC	20131119122102	500	500	B	N	N	F	658586	11	10617608	Y	49151																					
442	AI-XC	20131119122102	500	500	W	N	N	M	658707	11	10617609	Y	49151	"That we have created light and the diminishing of noncturnal species is declining and astonishing. ""The effecct is so powerful that scientist speak of songbirds being captured by searchlights on land or by the light from gas flares on marine oil platform until they drop"". he talked about how light pollution is the most easily remedied."																				
443	AI-XC	20131119122102	500	500	H	N	N	F	658904	11	10617610	Y	49151	"The author believes that light pollution is taking over a ""place"" in the world that does not belong to us. We are taking the night away from animals and plants that need it. For example, our long artificial days and short nights that we have made for ourselves has caused early breeding in birds."																				
444	AI-XC	20131119122102	500	500	H	N	N	F	659539	11	10617611	Y	49151	"In the sentence form the text the authors' opinion about light pollution letting the reader know that since the world already has too much light, space is just like a little night light compared to what we have turned the world into. In the text it says "" In most cities the sky looks as though it has been emptied of stars. leaving behind a vacant hax that mirrors our fear of the dark and resembles the urban glow of dystopian science fiction."																				
445	AI-XC	20131119122102	500	500	NR			F	660171	11	10617612	Y	49151	This sentence relates to the authors opinion by telling the reader he feels is is unessasary to have the night lit up.																				
446	AI-XC	20131119122102	500	500	NR			M	660558	11	10617613	Y	49151	No matter where humans are in the world, a technolgoy will at some point take over the land being occupied and become a part of the lifestyle of the population living in that area.																				
447	AI-XC	20131119122102	500	500	NR			F	660564	11	10617614	Y	49151	"There was no light on the Earth and then randomly at night we all turn the lights on like no one was there before us, ""unoccupied country."""																				
448	AI-XC	20131119122102	500	500	H	N	N	F	660586	11	10617615	Y	49151	this sentence relates to light pollution because																				
449	AI-XC	20131119122102	500	500	B	N	N	M	660593	11	10617616	Y	49151																					
