	AI_Prov_Name	File_Date	File_Count	Group_Count	Ethnicity	IEP	LEP	Gender	Ven_Stud_ID	Grade	Stud_Test_ID	Score_Flag	Item_ID	Item_Response	Final_Score	Data_Point	Read1_Date	Read1_ID	Read1_Score	Read1_Cond	Read2_Date	Read2_ID	Read2_Score	Read2_Cond	Read3_Date	Read3_ID	Read3_Score	Read3_Cond	Read5_Date	Read5_ID	Read5_Score	Read5_Cond	Alert_Code	Alert_ReaderID
0	AI-XC	20131119122053	500	500	W	N	N	F	747825	3	10581412	Y	51802	no   because   2/4   is   smaller  then   2/3.																				
1	AI-XC	20131119122053	500	500	W	N	N	F	747828	3	10581421	Y	51802	yes																				
2	AI-XC	20131119122053	500	500	A		Y	F	767683	3	10581423	Y	51802	Yes she is corrers																				
3	AI-XC	20131119122053	500	500	H	N	Y	M	768857	3	10581427	Y	51802	No,because 2/3 is a bigger piece than 2/4.																				
4	AI-XC	20131119122053	500	500	B			M	940281	3	10581431	Y	51802	They are the same thing.																				
5	AI-XC	20131119122053	500	500	W			M	940289	3	10581437	Y	51802	1/2																				
6	AI-XC	20131119122053	500	500	W			F	940323	3	10581446	Y	51802	yes, because 2 out of 4 has more shade than 2 out of 3.																				
7	AI-XC	20131119122053	500	500	B	N	N	F	940331	3	10581451	Y	51802	no because 3 is less than 4.																				
8	AI-XC	20131119122053	500	500	W	N	N	M	940361	3	10581457	Y	51802	Yes																				
9	AI-XC	20131119122053	500	500	P			M	940373	3	10581473	Y	51802	no because they are both equal																				
10	AI-XC	20131119122053	500	500	W	N	N	M	940408	3	10581480	Y	51802	yes, he is correct because the first number is a half and the second number is below half.																				
11	AI-XC	20131119122053	500	500	W	Y	N	F	940469	3	10581495	Y	51802	NO BECUS 2 4 FATHS IS THE SOME OF 2 3 THERDS.																				
12	AI-XC	20131119122053	500	500	NR			F	940504	3	10581501	Y	51802	Stanley is incorrect because it may seem that 4 is bigger than 3 but  in fractions it's less because it cuts more  and makes the part smaller and with the 3 it turns bigger so Stanley is incorrect																				
13	AI-XC	20131119122053	500	500	W	N	N	M	940527	3	10581503	Y	51802	yes. he is right because 2-4 is greater then 2-3.																				
14	AI-XC	20131119122053	500	500	H	Y	Y	M	940530	3	10581507	Y	51802	yes,because the greater then the number																				
15	AI-XC	20131119122053	500	500	W			F	940702	3	10581514	Y	51802	yes hes correct becaus it is greater																				
16	AI-XC	20131119122053	500	500	NR			M	940741	3	10581519	Y	51802	she coret																				
17	AI-XC	20131119122053	500	500	NR	N	N	M	940752	3	10581528	Y	51802	Stanley is not correct because 2/3 has the bottom number smaller than 2/4.																				
18	AI-XC	20131119122053	500	500	H	N	N	F	940839	3	10581535	Y	51802	Stanely is correct,because 4 piecesand subtract 2 is 2 3 pieces subtract 2 is 1. so Stanley is right.																				
19	AI-XC	20131119122053	500	500	P			F	940879	3	10581542	Y	51802	yes she is correct 2-4 are big but 2-3 are small.																				
20	AI-XC	20131119122053	500	500	P			M	940884	3	10581545	Y	51802	no she not correct																				
21	AI-XC	20131119122053	500	500	A	N	N	M	940945	3	10581550	Y	51802	yes because it has greater digits																				
22	AI-XC	20131119122053	500	500	NR	Y		M	940961	3	10581556	Y	51802	Stanley is  not correct that 2/4 is greater than 2/3 because 2/3is grater  than2/4.																				
23	AI-XC	20131119122053	500	500	NR			F	940964	3	10581562	Y	51802	No beacause even though 4 is bigger than 3, 2/3 is greater.																				
24	AI-XC	20131119122053	500	500	W	N	N	M	941010	3	10581565	Y	51802	no becuse  2/4 =8 and 2/3 =3																				
25	AI-XC	20131119122053	500	500	W	N	N	M	941018	3	10581569	Y	51802	Yes stanley is right because 2/3 2/4																				
26	AI-XC	20131119122053	500	500	W	N	N	M	941056	3	10581574	Y	51802	no she iset correct																				
27	AI-XC	20131119122053	500	500	W		N	F	941178	3	10581579	Y	51802	yes its a bigger numbber																				
28	AI-XC	20131119122053	500	500	W	N	Y	M	941201	3	10581586	Y	51802	yes																				
29	AI-XC	20131119122053	500	500	W			M	941337	3	10581591	Y	51802	Stanley is correct. 4 is greater and 3 is smaler																				
30	AI-XC	20131119122053	500	500	W	N		F	941456	3	10581596	Y	51802	Stanly is correct because 2-4 is more than 2-3 and he is correct.																				
31	AI-XC	20131119122053	500	500	NR			F	941511	3	10581601	Y	51802	Yes he is correct. I found out by makein pictures and counting what one had more.																				
32	AI-XC	20131119122053	500	500	A	N	N	F	941519	3	10581603	Y	51802	No because the greater parts in the whole thing, the lesser each equal part will be because each time a new part squeezes in, the other parts will get smaller. The whole thing dosen't change size only the equal parts inside do.																				
33	AI-XC	20131119122053	500	500	W			F	941661	3	10581607	Y	51802	no because 2/4 is 1/2. 2/3 is smaller.																				
34	AI-XC	20131119122053	500	500	W			M	941673	3	10581612	Y	51802	no 2/3is smaller so it's bigger																				
35	AI-XC	20131119122053	500	500	H	N	N	M	941764	3	10581617	Y	51802	no because the pieces of 2/3 would be bigger.																				
36	AI-XC	20131119122053	500	500	NR			M	941916	3	10581626	Y	51802	Stanley is not correct because however you draw a picture of 2/3, it will always be greater than 2/4.																				
37	AI-XC	20131119122053	500	500	W	N	N	F	942061	3	10581632	Y	51802	No, because																				
38	AI-XC	20131119122053	500	500	B	N	N	M	942145	3	10581638	Y	51802	no,because you can add it and it won't be an even number.																				
39	AI-XC	20131119122053	500	500	W	N	N	F	942216	3	10581646	Y	51802	he is not right becuase two fourths is smaller than two therds																				
40	AI-XC	20131119122053	500	500	H	N	Y	F	942232	3	10581651	Y	51802	No, because if you only share with 3 friends then you get a bigger piece. IF you share with 4 freinds then you get a smaller piece																				
41	AI-XC	20131119122053	500	500	H	N	Y	M	942241	3	10581656	Y	51802	she is correct becuase it big.																				
42	AI-XC	20131119122053	500	500	H	N	Y	M	942249	3	10581663	Y	51802	no,because greater is lesser.																				
43	AI-XC	20131119122053	500	500	NR			M	942360	3	10581667	Y	51802	yes,his answer is right																				
44	AI-XC	20131119122053	500	500	W	N	N	F	942362	3	10581673	Y	51802	Stanly is not correct. 2 3rds is greater than 2 4ths.																				
45	AI-XC	20131119122053	500	500	A	N	Y	M	942414	3	10581680	Y	51802	no because if he chose two thirds he will get a bigger piece																				
46	AI-XC	20131119122053	500	500	W	N	N	M	942565	3	10581696	Y	51802	No, Stanley incorrect because 2/4 is a half and 2/3 is more than a half so, that means 2/3 is greater.																				
47	AI-XC	20131119122053	500	500	B	N	N	M	942719	3	10581704	Y	51802	he is right because the higher nunber is bigger than the lower nunber.																				
48	AI-XC	20131119122053	500	500	H	N	Y	M	942753	3	10581708	Y	51802	he is correct because 2/4																				
49	AI-XC	20131119122053	500	500	W	N	Y	F	942760	3	10581714	Y	51802	THE BIGIR THE NUMBIR THE SMALLI THE PES .																				
50	AI-XC	20131119122053	500	500	H	N	Y	M	942777	3	10581721	Y	51802	Yes he is correct because i could see that he is correct even because the numbers are graeter than the other numbers in the story problem.stanley is correct in this kind of question.																				
51	AI-XC	20131119122053	500	500	W	N		M	942782	3	10581723	Y	51802	no,stanley is not correct because in two fourths,you whould get a smaller peice																				
52	AI-XC	20131119122053	500	500	W	N		F	942783	3	10581726	Y	51802	Yes because four is greter the three.It is one more.																				
53	AI-XC	20131119122053	500	500	H	N		M	942788	3	10581730	Y	51802	yes because four is greater than three																				
54	AI-XC	20131119122053	500	500	B	Y	N	M	942896	3	10581735	Y	51802	Yes . I think  that it is  greater than 2and3																				
55	AI-XC	20131119122053	500	500	H	N		F	942906	3	10581742	Y	51802	Yes,he is correct because the number 4 is greater then the number 3 so stanley is correct.																				
56	AI-XC	20131119122053	500	500	H	N		M	942909	3	10581745	Y	51802	yes because 2/4 is bigger han 2/3																				
57	AI-XC	20131119122053	500	500	B	N	N	F	942947	3	10581749	Y	51802	THAY ARE  =LE																				
58	AI-XC	20131119122053	500	500	W	N	N	M	943100	3	10581754	Y	51802	N																				
59	AI-XC	20131119122053	500	500	W	N	N	M	943102	3	10581760	Y	51802	no couse you had more																				
60	AI-XC	20131119122053	500	500	H	N	N	M	943200	3	10581776	Y	51802	no																				
61	AI-XC	20131119122053	500	500	NR			F	943218	3	10581782	Y	51802	He is wrong because if you cross multiply you will see that 2/3 is greater than 2/4																				
62	AI-XC	20131119122053	500	500	NR			M	943221	3	10581786	Y	51802	yes because when you make it . it will because it will have more.																				
63	AI-XC	20131119122053	500	500	NR			M	943257	3	10581791	Y	51802	no!!! becuse2_3 is odd																				
64	AI-XC	20131119122053	500	500	NR			F	943262	3	10581799	Y	51802	No,because its 1 off of two fourths.																				
65	AI-XC	20131119122053	500	500	H	N	Y	F	943310	3	10581818	Y	51802	yes because 2-4 is gerader																				
66	AI-XC	20131119122053	500	500	W	N	N	M	943327	3	10581837	Y	51802	No he is not because two frouths ins't grater than two thirds because the smaller means more that why Stanely is wrong.																				
67	AI-XC	20131119122053	500	500	W	N	N	F	943373	3	10581859	Y	51802	yes becuse it is bigger																				
68	AI-XC	20131119122053	500	500	B			M	943467	3	10581878	Y	51802	stanley is wrong because 2/3 is better than 2/4 you get more out of 2/3.																				
69	AI-XC	20131119122053	500	500	H		N	F	943502	3	10581896	Y	51802	YES BECAUSE 2/4 is bigger than 2/3 .																				
70	AI-XC	20131119122053	500	500	H		Y	F	943511	3	10581916	Y	51802	Stanley  is  correct   because  2/4  is   greater   than  2/3.																				
71	AI-XC	20131119122053	500	500	H		Y	M	943554	3	10581953	Y	51802	no  beacause  2/3  is  bigger  than  2/4																				
72	AI-XC	20131119122053	500	500	H	N	N	M	943672	3	10581960	Y	51802	Stanley is write because it is bigger than 2/3.																				
73	AI-XC	20131119122053	500	500	H	N	N	F	943673	3	10581984	Y	51802	no beacuse,2 out of 4 has more shaded in.																				
74	AI-XC	20131119122053	500	500	NR			M	943700	3	10581988	Y	51802	yes																				
75	AI-XC	20131119122053	500	500	W	Y	N	M	943721	3	10581994	Y	51802	_																				
76	AI-XC	20131119122053	500	500	W	N	N	M	943782	3	10582000	Y	51802	Yes , because 2/4 = 1/2 and 2/3 is a little smaller than 2/4.																				
77	AI-XC	20131119122053	500	500	W	N	N	F	943784	3	10582024	Y	51802	No,because if you divide in 4ths you have more picices.																				
78	AI-XC	20131119122053	500	500	W			F	943791	3	10582029	Y	51802	NO he is NOT correct.Draw a fraction bar and you will see!																				
79	AI-XC	20131119122053	500	500	W			F	943863	3	10582034	Y	51802	No, he is not correct.If the denominator is smaller the number is bigger.																				
80	AI-XC	20131119122053	500	500	A		Y	M	943864	3	10582040	Y	51802	NO BECAUSE IT MAKES IT SMALLER.																				
81	AI-XC	20131119122053	500	500	H	N	Y	F	944088	3	10582064	Y	51802	yes																				
82	AI-XC	20131119122053	500	500	B		N	M	944103	3	10582067	Y	51802	yes																				
83	AI-XC	20131119122053	500	500	A	N	N	F	944151	3	10582074	Y	51802	He says that it is greater than the other fraction. So, i agree with him that it is greater. I think that he is correct that it is greater that he combined the two fractions. He is correct that it is greater.																				
84	AI-XC	20131119122053	500	500	NR	N	N	F	944163	3	10582087	Y	51802	stanly is rong. because they are the same as ecah other																				
85	AI-XC	20131119122053	500	500	NR			F	944194	3	10582091	Y	51802	Yes.  Stanley is correct because the denominator is bigger.																				
86	AI-XC	20131119122053	500	500	W			F	944206	3	10582098	Y	51802	Stanley is wroung 2/3 is more because in a circle 3 peices is more then four																				
87	AI-XC	20131119122053	500	500	W			M	944234	3	10582121	Y	51802	No.Becuase 2/4's is 1 half and 1 half is bigger.																				
88	AI-XC	20131119122053	500	500	W			M	944266	3	10582123	Y	51802	2 4th is grater than 2 3rd																				
89	AI-XC	20131119122053	500	500	B			F	944290	3	10582127	Y	51802	Yes because the bottom number is higher than the top number (fractions).																				
90	AI-XC	20131119122053	500	500	H			M	944332	3	10582132	Y	51802	yes he is you can tell by the look																				
91	AI-XC	20131119122053	500	500	W			F	944355	3	10582139	Y	51802	NO! .																				
92	AI-XC	20131119122053	500	500	NR			M	944375	3	10582162	Y	51802	less then																				
93	AI-XC	20131119122053	500	500	B			M	944383	3	10582165	Y	51802	yes																				
94	AI-XC	20131119122053	500	500	B			M	944385	3	10582168	Y	51802	yes																				
95	AI-XC	20131119122053	500	500	W	N	N	M	944401	3	10582176	Y	51802	yes																				
96	AI-XC	20131119122053	500	500	W	Y	N	F	944402	3	10582201	Y	51802	yes																				
97	AI-XC	20131119122053	500	500	NR			M	944413	3	10582203	Y	51802	yes																				
98	AI-XC	20131119122053	500	500	NR			F	944476	3	10582207	Y	51802	yes because four is greater than three																				
99	AI-XC	20131119122053	500	500	NR			F	944477	3	10582212	Y	51802	Well if you bought a pizza and you split it into sixths and you ate 3 peaces you would have 3 peaces left and if you ate 4 peaces you would have 2 peaces left .																				
100	AI-XC	20131119122053	500	500	NR			M	944479	3	10582219	Y	51802	yes because the dinamunater is grater.																				
101	AI-XC	20131119122053	500	500	NR			M	944534	3	10582242	Y	51802	Well it isint just right 2-3 is closer to 1 whole 2-4 is not closer to 1 whole																				
102	AI-XC	20131119122053	500	500	W	N	N	M	944542	3	10582245	Y	51802	No because thirds are bigger than fourths.																				
103	AI-XC	20131119122053	500	500	W	N	N	M	944548	3	10582250	Y	51802	yes because 4 is bigger then 3																				
104	AI-XC	20131119122053	500	500	H	Y	Y	M	944564	3	10582255	Y	51802	no																				
105	AI-XC	20131119122053	500	500	H	N	Y	F	944566	3	10582269	Y	51802	no its not correct because their both the same.																				
106	AI-XC	20131119122053	500	500	W	N	N	F	944625	3	10582275	Y	51802	yes, because that kinda eqauls one half that is one hole two thirds are a little less																				
107	AI-XC	20131119122053	500	500	W	Y		F	944634	3	10582280	Y	51802	correct																				
108	AI-XC	20131119122053	500	500	W			M	944681	3	10582303	Y	51802	no becaus in frakshuns the smal number is the big number.																				
109	AI-XC	20131119122053	500	500	H	N	N	M	944755	3	10582308	Y	51802	No she is not correct because 2-4 is least than 2-3.																				
110	AI-XC	20131119122053	500	500	H	N	Y	F	944784	3	10582314	Y	51802	Yes because 3 is a little number and 4 is a big number so she is right.																				
111	AI-XC	20131119122053	500	500	NR			M	944815	3	10582323	Y	51802	A third is bigger than a forth because,  the number the smaller the pieces.																				
112	AI-XC	20131119122053	500	500	NR			F	944854	3	10582327	Y	51802	Stanley is wrong because just because 4 is bigger than 3 doesn't mean it's bigger in fractions picture a circle cut into forths then a circle cut into thirds the thirds are bigger than forths so it would mean that if 2 of the 3rds were shaded they would be bigger.																				
113	AI-XC	20131119122053	500	500	NR			F	944867	3	10582333	Y	51802	no because 2 4ths is smaller peices.																				
114	AI-XC	20131119122053	500	500	NR			F	944902	3	10582339	Y	51802																					
115	AI-XC	20131119122053	500	500	H	N		M	944922	3	10582362	Y	51802	no she right the frist is better than the second one																				
116	AI-XC	20131119122053	500	500	H		Y	F	944931	3	10582365	Y	51802	Stanley is correct because 4 is greater than3.																				
117	AI-XC	20131119122053	500	500	H			F	944975	3	10582370	Y	51802	Stanely is incorrect.  The correct answer is 2/4 because 2/3 is three and two shaded.																				
118	AI-XC	20131119122053	500	500	A			M	944979	3	10582376	Y	51802	NO HE IS WRONG BECAUSE 2 OUT OF FOUR IS HALF. 2 OUT OF 3 IS MORE THAN HALF.																				
119	AI-XC	20131119122053	500	500	NR			F	945026	3	10582398	Y	51802	yes, he is correct it is graeter than the 2 4th																				
120	AI-XC	20131119122053	500	500	A	N	Y	F	945031	3	10582414	Y	51802	No , because 2/3 has bigger pieces.																				
121	AI-XC	20131119122053	500	500	H	N	Y	M	945059	3	10582420	Y	51802	stanley is rieat becuse its bigger																				
122	AI-XC	20131119122053	500	500	H	N	Y	M	945092	3	10582436	Y	51802	No because in fractions the (denominator)shorter it is the bigger the piece																				
123	AI-XC	20131119122053	500	500	A		N	M	945100	3	10582443	Y	51802	yes because there are 2parts out of 4parts and 2 parts out of 3parts																				
124	AI-XC	20131119122053	500	500	B	Y		F	945141	3	10582447	Y	51802	Yes because 2/4 is greater than 2/3.																				
125	AI-XC	20131119122053	500	500	B			F	945185	3	10582452	Y	51802	Yes he is becuase four is greater than three																				
126	AI-XC	20131119122053	500	500	NR			F	945246	3	10582456	Y	51802	yes. 4 is bigger then 3.																				
127	AI-XC	20131119122053	500	500	W	N	N	F	945363	3	10582461	Y	51802	heck ya he is right because when the denominater is the same and the numerator that is smaller the fraction is greater and it is the same the same the other way around																				
128	AI-XC	20131119122053	500	500	B	Y		F	945416	3	10582463	Y	51802	23 is greater then 24																				
129	AI-XC	20131119122053	500	500	NR			M	945524	3	10582467	Y	51802	Yes, Stanley is correct beacause,two fourths is greater than two thirds,two thirds is less than two fourths.																				
130	AI-XC	20131119122053	500	500	B	N	N	M	945543	3	10582471	Y	51802	stanley is incorrect because 2/4 is less than 2/3																				
131	AI-XC	20131119122053	500	500	H	N	N	M	945720	3	10582476	Y	51802	no becaus 4-2=2 and 3-2=1.																				
132	AI-XC	20131119122053	500	500	H	N	Y	F	945722	3	10582481	Y	51802	no she is wrong 2-3 is greater than 2-4																				
133	AI-XC	20131119122053	500	500	H	N	Y	M	945723	3	10582483	Y	51802	no because less is more and more makes it skiny																				
134	AI-XC	20131119122053	500	500	W	N	N	M	945958	3	10582486	Y	51802	two 4ths is half and half of three is one and a half which is less than two so two is bigger than one and a half so that means hes  WWRROONNGG!!!																				
135	AI-XC	20131119122053	500	500	W	N	N	M	945965	3	10582490	Y	51802	If the denomanateris biger then the other one the biger denomanater the biger the piece.The aneser is 2/3.																				
136	AI-XC	20131119122053	500	500	W	N	N	F	945969	3	10582495	Y	51802	no he  is   roing																				
137	AI-XC	20131119122053	500	500	H	Y		F	945971	3	10582500	Y	51802	it is not becaues 2/4 takes sli.																				
138	AI-XC	20131119122053	500	500	NR			M	946043	3	10582510	Y	51802	no it is not greater because 2/3 is more than 2/4.																				
139	AI-XC	20131119122053	500	500	NR			M	946117	3	10582517	Y	51802	yes stanley is correct because if you add 2 4ths the total will be 6 if you add 2 3rds the total will be 5																				
140	AI-XC	20131119122053	500	500	W			F	946135	3	10582519	Y	51802	Stanley is correct about 2-4 is greater then 2-3																				
141	AI-XC	20131119122053	500	500	W	N	N	F	946212	3	10582527	Y	51802	No because if it was candy and you broke it  into two fourths you would not get not as munch with two thirds  so if you get the bigger peace you would get more and you would be happer then with two fourths it is a bigger number but when you take it and break it  up it is not as munch as you though it to be  so realy two thirds is realy the bigger number then two fourths.																				
142	AI-XC	20131119122053	500	500	NR			M	946229	3	10582532	Y	51802	I think is right to because 2/4 is a bigger fraction than 2/3																				
143	AI-XC	20131119122053	500	500	NR			M	946276	3	10582535	Y	51802	Yes stanley is correct because two forths are greater than two thirds are less than two forths																				
144	AI-XC	20131119122053	500	500	W	N	N	M	946358	3	10582539	Y	51802	yes because in two thirds thier is one left then two fourths thier is two left.																				
145	AI-XC	20131119122053	500	500	NR			M	946382	3	10582546	Y	51802	The top is the same so I look at the boden and see wich number is smaller.																				
146	AI-XC	20131119122053	500	500	W	N	N	M	946407	3	10582551	Y	51802	staley is not correct.why because they are both eqil.																				
147	AI-XC	20131119122053	500	500	W	N	N	M	946470	3	10582555	Y	51802	no!																				
148	AI-XC	20131119122053	500	500	W	N	N	M	946531	3	10582559	Y	51802	yes  stanley is correct																				
149	AI-XC	20131119122053	500	500	W	N	N	M	946550	3	10582567	Y	51802	the denominator with the smallest number is greater than the one with the greatest numerator																				
150	AI-XC	20131119122053	500	500	B		N	F	946632	3	10582572	Y	51802	no because it not count right.																				
151	AI-XC	20131119122053	500	500	W	Y	N	M	946659	3	10582577	Y	51802	stanley is rong																				
152	AI-XC	20131119122053	500	500	W	N	N	M	946690	3	10582582	Y	51802	He is not correct because two fourths 2 left over.Two thirds has one left over.																				
153	AI-XC	20131119122053	500	500	A	N	N	M	946862	3	10582585	Y	51802	No 2\3 is greater than 1\2																				
154	AI-XC	20131119122053	500	500	H	N	N	F	946866	3	10582590	Y	51802	no, becuse 2/4 is a smaller amunt.																				
155	AI-XC	20131119122053	500	500	NR			F	947010	3	10582595	Y	51802	No Stan is not correct. The smaller the number is the bigger it is.																				
156	AI-XC	20131119122053	500	500	W	Y	N	M	947031	3	10582600	Y	51802	No besause there is more pliace two fourths.																				
157	AI-XC	20131119122053	500	500	B	N	N	F	947034	3	10582606	Y	51802	yes he his explain my thinking 24th is																				
158	AI-XC	20131119122053	500	500	W	N	N	F	947098	3	10582611	Y	51802	No because the biger the number is the smaler it gets.																				
159	AI-XC	20131119122053	500	500	H	N	N	M	947111	3	10582616	Y	51802	he is correct because in standerd form it would be 1 half. 1 half is greater than 2 thirds																				
160	AI-XC	20131119122053	500	500	H	N	Y	M	947184	3	10582621	Y	51802	2-4-2-3																				
161	AI-XC	20131119122053	500	500	P	N	Y	M	947195	3	10582660	Y	51802	no,the larger the size the less you get.																				
162	AI-XC	20131119122053	500	500	H	N	N	M	947266	3	10582668	Y	51802	No stanly is not write  because two thirds is more.																				
163	AI-XC	20131119122053	500	500	W	N	N	F	947377	3	10582673	Y	51802	It is correct because the denoter 4 is bigger is bigger tha the denamnater 3.																				
164	AI-XC	20131119122053	500	500	B			F	947438	3	10582679	Y	51802	I think that  Stanley  is   wrong   because if  you have  your  fraction cards  and  find  2/3  and 2/4 then you  par  them  and  thats  how  find  your  answer.																				
165	AI-XC	20131119122053	500	500	W	N	N	M	947619	3	10582684	Y	51802	Stanley is right because 24  is greater than 23. I know that because greater means higher and 24 is higher then 23.																				
166	AI-XC	20131119122053	500	500	NR			F	947627	3	10582689	Y	51802	yes because 4 is great then 3																				
167	AI-XC	20131119122053	500	500	W	N	N	F	947640	3	10582695	Y	51802	No there the same.																				
168	AI-XC	20131119122053	500	500	NR			M	947656	3	10582699	Y	51802	no because 3 is less than 4.																				
169	AI-XC	20131119122053	500	500	A	N	N	F	947688	3	10582706	Y	51802	no because 2/3 is bigger than 2/4 you have a pizza and theres 3 whole slices in all you take 2 theres only 1 left but if you have a pizza and theres 4 slices in all you take 2 theres 2 left																				
170	AI-XC	20131119122053	500	500	W	N	N	F	947691	3	10582711	Y	51802	Stanly is incorrect.2/3 is bigger because their is more of it than 2/4. That is my answer.																				
171	AI-XC	20131119122053	500	500	NR			F	947701	3	10582715	Y	51802	No,Stanley is not correct because if the bottom number is smaller the peice is bigger or they could be the same size.																				
172	AI-XC	20131119122053	500	500	NR			M	947723	3	10582719	Y	51802	no because fourths are smaller than thirds so 2/4 is smaller than 2/3																				
173	AI-XC	20131119122053	500	500	A		Y	M	947792	3	10582723	Y	51802	2/3 is bigger then 2/4																				
174	AI-XC	20131119122053	500	500	W			F	947847	3	10582727	Y	51802	yes he corect because i cheked																				
175	AI-XC	20131119122053	500	500	NR		N	M	947862	3	10582730	Y	51802	no,because the denomameter of 4 & 3.when i look at the 2 fration'si have to lokk for the hiset number.																				
176	AI-XC	20131119122053	500	500	A	N	Y	F	947868	3	10582734	Y	51802	No.																				
177	AI-XC	20131119122053	500	500	H	N	Y	F	947871	3	10582738	Y	51802	Yes because the bottom number is bigger than 3.																				
178	AI-XC	20131119122053	500	500	H	N	Y	F	947950	3	10582742	Y	51802	yes,because 2/3 is less than 2/4																				
179	AI-XC	20131119122053	500	500	W	N	N	F	948115	3	10582746	Y	51802	yes he is because if you have a two on top of a four it is bigger than a three																				
