	AI_Prov_Name	File_Date	File_Count	Group_Count	Ethnicity	IEP	LEP	Gender	Ven_Stud_ID	Grade	Stud_Test_ID	Score_Flag	Item_ID	Item_Response	Final_Score	Data_Point	Read1_Date	Read1_ID	Read1_Score	Read1_Cond	Read2_Date	Read2_ID	Read2_Score	Read2_Cond	Read3_Date	Read3_ID	Read3_Score	Read3_Cond	Read5_Date	Read5_ID	Read5_Score	Read5_Cond	Alert_Code	Alert_ReaderID
359	AI-XC	20131119122053	500	500	W	N	N	F	974295	3	10585571	Y	51802	He is correct because 4 is more than 3 so he is correct.																				
360	AI-XC	20131119122053	500	500	W	N	N	F	974303	3	10585576	Y	51802	no stanly is incorect my teacherv taught me that whatever looks smaller is the bigger number in frachins.																				
361	AI-XC	20131119122053	500	500	NR			M	974308	3	10585607	Y	51802	Stanley is rong 2/4 is less then 2/3.     If you have 2/3 of pizza there would be less left.																				
362	AI-XC	20131119122053	500	500	B	N		F	974384	3	10585613	Y	51802	yes because 2/4ths=2 and 2/3rds=1and we all know 2 is biger then one.																				
363	AI-XC	20131119122053	500	500	H	N	N	F	974406	3	10585619	Y	51802	no,because if you make 2 equivilent rectangles you can make 3 parts in one rectangle and four parts in the other																				
364	AI-XC	20131119122053	500	500	NR			F	974409	3	10585664	Y	51802	Yes because 4 is greater then 3.																				
365	AI-XC	20131119122053	500	500	W			M	974521	3	10585668	Y	51802	I think the smaller the number the bigger.																				
366	AI-XC	20131119122053	500	500	B	N	N	F	974553	3	10585673	Y	51802	yes beacuse 2/4 is  biger then 2/3																				
367	AI-XC	20131119122053	500	500	W		Y	M	974602	3	10585680	Y	51802	no shes wrong 2/4 are less because there is 2 stuff in there and 2/3 has 1 stuff so no shes wrong																				
368	AI-XC	20131119122053	500	500	B		N	M	974604	3	10585721	Y	51802	Stanley is wrong because,  usually the donominator is smaller than the larger donominator and when you multiply the donominator whis 4x3,you put the 4 by the three and the three by the 4.																				
369	AI-XC	20131119122053	500	500	H	N	Y	F	974697	3	10585723	Y	51802	yes,because the 4 is greater then the 3																				
370	AI-XC	20131119122053	500	500	B		N	M	974839	3	10585727	Y	51802	she is corect because the botom number 2/4 is bigger than 2/3.																				
371	AI-XC	20131119122053	500	500	W			F	975015	3	10585731	Y	51802	NO STANLEY IS NOT CORRECT BECAUSE THE BIGGER THE DENOMANATOR THE SMALLER THE THING																				
372	AI-XC	20131119122053	500	500	2		N	M	975103	3	10585738	Y	51802	He is wrong because the lower fraction is the bigger one.																				
373	AI-XC	20131119122053	500	500	W			F	975413	3	10585813	Y	51802	yes because if you draw a picture of a pizza and make two lines through it then color in 2 sides then you will have two sides left.																				
374	AI-XC	20131119122053	500	500	B	N	N	F	975465	3	10585842	Y	51802	4 7																				
375	AI-XC	20131119122053	500	500	I			F	975496	3	10585846	Y	51802	It has to be 4/7.																				
376	AI-XC	20131119122053	500	500	W	N	N	M	975594	3	10585850	Y	51802	he is write																				
377	AI-XC	20131119122053	500	500	W	N	N	M	975660	3	10585853	Y	51802	stanley is corret because two out of four is higher																				
378	AI-XC	20131119122053	500	500	H	N	N	F	975665	3	10585857	Y	51802	yes becoes 4 is biger then 3																				
379	AI-XC	20131119122053	500	500	W	N	N	F	975858	3	10585896	Y	51802	No, Stanley is not correct. 2/3 is greater than half, 2/4 IS half. Therefore, Stanley isn't correct.																				
380	AI-XC	20131119122053	500	500	W	N	N	F	976105	3	10585928	Y	51802	no,because 2 is not greater than 2																				
381	AI-XC	20131119122053	500	500	W			M	976233	3	10585933	Y	51802	stanly is not correct because 2/4 is smaller than 2/3 because the bigger the fraction the smaller it gets and if they have the same numerator than the bigger denominator is the smaller fration.																				
382	AI-XC	20131119122053	500	500	W	N	N	F	976240	3	10585938	Y	51802	well i think stanley is in corect because lets say you have a pizza,2/4<2/3 because you be able to eat more.																				
383	AI-XC	20131119122053	500	500	W	N	N	F	976242	3	10585967	Y	51802	she is not correct becous 2\4 is 1\2 and 2\3 is more than 1\2																				
384	AI-XC	20131119122053	500	500	2	N	N	F	976310	3	10585972	Y	51802	No Stanley is not right, because the smaller number on the bottem is smaller then the greater  number on the bottem.																				
385	AI-XC	20131119122053	500	500	H	N	N	M	976335	3	10585978	Y	51802	no.																				
386	AI-XC	20131119122053	500	500	W	N	N	F	976422	3	10586004	Y	51802	yes 2/4 is greater than 2/3																				
387	AI-XC	20131119122053	500	500	A	N	Y	M	976528	3	10586008	Y	51802	no beacuse 1/3 is bigger than 1/4																				
388	AI-XC	20131119122053	500	500	NR			F	976553	3	10586013	Y	51802	2-3 is one half smaller then 2-4																				
389	AI-XC	20131119122053	500	500	W	N	N	F	976853	3	10586018	Y	51802	he is correct because 4 is bigger than 3.																				
390	AI-XC	20131119122053	500	500	NR			M	976874	3	10586046	Y	51802	yes four is a greater																				
391	AI-XC	20131119122053	500	500	W			M	976908	3	10586051	Y	51802	No becuse the smaller the denominator the biger the peise																				
392	AI-XC	20131119122053	500	500	H	N	Y	M	977045	3	10586057	Y	51802	no because if you have 1 cup cake and tere is ten peploe you will just have a crum																				
393	AI-XC	20131119122053	500	500	NR			F	977084	3	10586083	Y	51802	it is correct because it is one hire																				
394	AI-XC	20131119122053	500	500	NR			F	977134	3	10586087	Y	51802	yes she is correct																				
395	AI-XC	20131119122053	500	500	W			M	977172	3	10586092	Y	51802	I think stanley is right, because 4 is bigger than 3.																				
396	AI-XC	20131119122053	500	500	W	N	N	M	977267	3	10586098	Y	51802	He is correct 4 pices is greater then 3																				
397	AI-XC	20131119122053	500	500	W			M	977319	3	10586142	Y	51802	stanley is not correct because 2/4 is one half so 2/3 is closer to one whole																				
398	AI-XC	20131119122053	500	500	H	N	Y	M	977532	3	10586145	Y	51802	no because 2/4 has a little peice.																				
399	AI-XC	20131119122053	500	500	W	Y	N	F	977647	3	10586149	Y	51802	yes, because 2/4 has more parts than 3 parts 4 greater.																				
400	AI-XC	20131119122053	500	500	W	N	N	F	977667	3	10586155	Y	51802	No she is not correct.Because the bigger the number the smaler the peace.																				
401	AI-XC	20131119122053	500	500	B	N	N	F	977762	3	10586204	Y	51802	2/3 is bigger because when you draw it out draw a rectangle  just flip it over so it londer split it in half leabelit draw 4 squares in 1 half draw 3 on the other make sure its equal shade 2 for 2/4 and 2/ for 2/3 thats how its bigger.																				
402	AI-XC	20131119122053	500	500	B	N	N	F	977898	3	10586212	Y	51802	yes.Because 2-4 is a higher number then 2-3.																				
403	AI-XC	20131119122053	500	500	H	N	N	M	977966	3	10586218	Y	51802	blo																				
404	AI-XC	20131119122053	500	500	H		Y	F	977971	3	10586297	Y	51802	yes he is correct because two-fourths are greater than tow-thirds.																				
405	AI-XC	20131119122053	500	500	NR			F	978411	3	10586339	Y	51802	no     beacuse 4 is biger than 3. See 1234																				
406	AI-XC	20131119122053	500	500	W	N	N	F	978428	3	10586387	Y	51802	yes																				
407	AI-XC	20131119122053	500	500	W	N	N	F	978948	3	10586392	Y	51802	He is not correct.Two thirds have bigger pieces.																				
408	AI-XC	20131119122053	500	500	H		Y	F	979097	3	10586399	Y	51802	stanley is not correct because 2/3 is bigger then 2/4																				
409	AI-XC	20131119122053	500	500	H	N	N	F	979518	3	10586443	Y	51802	yes because the top two numbers are the same so i looked at the bottom numbers and 4 is bigger than 3																				
410	AI-XC	20131119122053	500	500	H	N	Y	F	979550	3	10586447	Y	51802	i think stanley is correct because 4 is   grater than 3																				
411	AI-XC	20131119122053	500	500	A			F	979623	3	10586451	Y	51802	no because 2\3 is greater than 2\4 because if you draw a picture of each fraction 2\3 would be greater																				
412	AI-XC	20131119122053	500	500	A	N	N	F	979673	3	10586458	Y	51802	stanley's wrong because 2/3 is greater because the smaller is greater																				
413	AI-XC	20131119122053	500	500	H		N	M	979792	3	10586502	Y	51802	Yes he is correct becase it is greater																				
414	AI-XC	20131119122053	500	500	W	N	N	F	979984	3	10586505	Y	51802	I think Stanley is corect because the bottom numbers are diffrent.4 is greater than 3 so 2 forths is greater than 2 thirds.																				
415	AI-XC	20131119122053	500	500	2	N	N	F	980024	3	10586510	Y	51802	I think he's rong cause I redused it.																				
416	AI-XC	20131119122053	500	500	W	N	N	M	980046	3	10586515	Y	51802	No,I do not think Stanley is correct because. if 2/4 is a half but 1/3 is just slightly larger.																				
417	AI-XC	20131119122053	500	500	W	Y	N	M	980097	3	10586519	Y	51802	yes becaues deomerater of 2/4 is biger   than 2/3 becaues the deomerater is 3 4 is biger																				
418	AI-XC	20131119122053	500	500	H	Y	N	M	980223	3	10586562	Y	51802	YES HE IS CORRECT																				
419	AI-XC	20131119122053	500	500	H	N	N	F	980318	3	10586565	Y	51802	yes,because2/4 is greater then2/3																				
420	AI-XC	20131119122053	500	500	H	N	Y	M	980343	3	10586570	Y	51802	Staniey is not correct because on fracthins the lowist numers are biger.																				
421	AI-XC	20131119122053	500	500	H		N	M	980392	3	10586575	Y	51802	jh																				
422	AI-XC	20131119122053	500	500	H	N	Y	F	980538	3	10586613	Y	51802	The answer is not correct.																				
423	AI-XC	20131119122053	500	500	W	N	N	M	980570	3	10586620	Y	51802	It's wrong because the smaller the denominator, the bigger the piece																				
424	AI-XC	20131119122053	500	500	W	N	N	M	980580	3	10586664	Y	51802	stanley is correct because 2forths is bigger than 2thirds.Also because 4 is greater than 3.																				
425	AI-XC	20131119122053	500	500	W	N	N	F	980597	3	10586667	Y	51802	Yes because if you draw a peromed and do a whole then a half an go smaller and smaller you will see that  the 2 3rd is biger than 2 4th because there is 1 left in the 2 3rd and 2 left in the 2 4th.																				
426	AI-XC	20131119122053	500	500	W	N	N	M	980658	3	10586671	Y	51802	No, because thirds have bigger peices than fourths and numerators are the same.																				
427	AI-XC	20131119122053	500	500	H	N	N	M	980703	3	10586677	Y	51802	?																				
428	AI-XC	20131119122053	500	500	H	N	N	M	981510	3	10586708	Y	51802	yes he is right the denominator is greater																				
429	AI-XC	20131119122053	500	500	A	Y	Y	F	981556	3	10586714	Y	51802	Yes.The number on the bottom is smaller so it is greater.																				
430	AI-XC	20131119122053	500	500	H	Y	Y	F	981561	3	10586744	Y	51802	greater then 2-3 because the small one is larger then the bigger one																				
431	AI-XC	20131119122053	500	500	NR			F	981659	3	10586748	Y	51802	No.He is wrong,because if you had a pie would you like a tiny piece ?																				
432	AI-XC	20131119122053	500	500	W	N	N	M	982167	3	10586754	Y	51802	no 2/3 is closer to a whole than 2/4																				
433	AI-XC	20131119122053	500	500	W	N	N	M	983805	3	10586760	Y	51802	No, because if the number at the top is the same as the number on the other side but the number on the botton tells if one of the pieces would be bigger. If a number is smaller on the bottom but the top numbers are the same go with the smaller number on the bottom.																				
434	AI-XC	20131119122053	500	500	W	N	N	F	984405	3	10586801	Y	51802	No.because if you drew 2 rectangles and devided one in four and one in three and shaded 2 in each they would be the same because they have only 2 shaded in bolth.																				
435	AI-XC	20131119122053	500	500	H	N	N	M	985952	3	10586803	Y	51802	yes because 1half is biger than 2 thirds is smaller than 1half																				
436	AI-XC	20131119122053	500	500	W	N	N	M	987426	3	10586807	Y	51802	no																				
437	AI-XC	20131119122053	500	500	H	N	Y	M	988096	3	10586812	Y	51802	stanley is incorrect because 2/3 bigger shaded																				
438	AI-XC	20131119122053	500	500	H		N	F	990571	3	10586820	Y	51802	yes because the top is the same so then u go to the the bottomso 4 is greater then 3 so that means Stanley is right																				
439	AI-XC	20131119122053	500	500	W	N		F	991027	3	10586864	Y	51802	NO STANLEY IS WORNG BECAUSE WHEN YOU DRAW IT OUT 2/3 IS BIGGER THAN 2/4.																				
440	AI-XC	20131119122053	500	500	W	N		M	991246	3	10586867	Y	51802	no 2/3 is big then 2/4																				
441	AI-XC	20131119122053	500	500	A	N	Y	M	991276	3	10586871	Y	51802	No because when you draw it you can see it																				
442	AI-XC	20131119122053	500	500	NR			F	991488	3	10586877	Y	51802	Yes, Because if you have a pizza with 4 slices then it is bigger than a pizza with 2 slices.																				
443	AI-XC	20131119122053	500	500	W	N		M	991571	3	10586913	Y	51802	yes she is right because 2 4ths is grater than 2 3thtrds.																				
444	AI-XC	20131119122053	500	500	A	N	Y	M	992248	3	10586944	Y	51802	yes.because the half are bigger																				
445	AI-XC	20131119122053	500	500	W	N	Y	M	992356	3	10586948	Y	51802	because twoforth is grater then twothreed.																				
446	AI-XC	20131119122053	500	500	H	N	Y	M	992703	3	10586954	Y	51802	two foer is the anwer.																				
447	AI-XC	20131119122053	500	500	H	N	N	F	992832	3	10586985	Y	51802	yes he is correct cause 24  is  greater  than   23																				
448	AI-XC	20131119122053	500	500	H	N	N	M	992974	3	10586990	Y	51802	yes becuse 2/4 is half of 1/2																				
449	AI-XC	20131119122053	500	500	B	N	N	F	993037	3	10586994	Y	51802	Yes.Because it is greater than it.																				
450	AI-XC	20131119122053	500	500	H	N	Y	F	993353	3	10587030	Y	51802	yes b/c 2 out of 4 is big then 2 out of 3																				
451	AI-XC	20131119122053	500	500	NR	N	N	M	993479	3	10587035	Y	51802	yes,2/4 is the same as 1/2																				
452	AI-XC	20131119122053	500	500	NR			M	993511	3	10587040	Y	51802	no, becuase less does not take up more space																				
453	AI-XC	20131119122053	500	500	H		N	F	993663	3	10587094	Y	51802	Stanly is correct because 2\4																				
454	AI-XC	20131119122053	500	500	W	N	N	F	993687	3	10587100	Y	51802	yes because 4 is greater then 3																				
455	AI-XC	20131119122053	500	500	H		N	M	993711	3	10587144	Y	51802	YES IT IS CORRECT .																				
456	AI-XC	20131119122053	500	500	NR			M	993760	3	10587147	Y	51802	no he is not because the smaller the denominator the bigger the fraction																				
457	AI-XC	20131119122053	500	500	H	N	N	F	993801	3	10587152	Y	51802	No Stanley is wrong because if  it is 2 the biger number comes  first																				
458	AI-XC	20131119122053	500	500	NR	N	N	M	993806	3	10587158	Y	51802	Yes it is greater because 4 is greater then 3																				
459	AI-XC	20131119122053	500	500	W	N	N	F	993842	3	10587202	Y	51802	no because,the smaller the number is the bigger the piece.																				
460	AI-XC	20131119122053	500	500	H	N	N	M	993873	3	10587206	Y	51802	stanljt																				
461	AI-XC	20131119122053	500	500	W	N	N	F	994018	3	10587209	Y	51802	Stanley is not correct because he thinks a 4th is greater than a 3rd but its not.Because the smaller the fraction the bigger it is.																				
462	AI-XC	20131119122053	500	500	W	N	N	F	994028	3	10587216	Y	51802	No because the lower the number the grater.																				
463	AI-XC	20131119122053	500	500	W	N	N	F	994063	3	10587262	Y	51802	No because when it is on paper 2/3 is greater than2/4.																				
464	AI-XC	20131119122053	500	500	W	N	N	M	994115	3	10587265	Y	51802	No, beacuse the smaller number on the botom mean's there are lese line's so 2/3therd's is bigger.																				
465	AI-XC	20131119122053	500	500	H	N	Y	F	994311	3	10587269	Y	51802	yes she is correct																				
466	AI-XC	20131119122053	500	500	A	N	Y	F	994315	3	10587275	Y	51802	No she is not correct because if you draw out 2/4 and 2/3 you can see 2/4 pieces are smaller.																				
467	AI-XC	20131119122053	500	500	H	N	Y	M	994320	3	10587354	Y	51802	no i can tell becuase  in fractions  its like that																				
468	AI-XC	20131119122053	500	500	H	N	Y	M	994432	3	10587360	Y	51802	Stanley is uncorrect because twofourth.																				
469	AI-XC	20131119122053	500	500	W	Y		M	995072	3	10587410	Y	51802	I think that 2-3s are greater than 2-4s																				
470	AI-XC	20131119122053	500	500	W	N		F	995081	3	10587416	Y	51802	No, Stanly is not right because 2/4 is equal to 1/2 and3/4 is bigger than 1/2.																				
471	AI-XC	20131119122053	500	500	B	N	N	F	995155	3	10587456	Y	51802	yes because if a bigger number is on the bottom than its write																				
472	AI-XC	20131119122053	500	500	W			M	995213	3	10587529	Y	51802	yes because in fractions 3 is grator than 4																				
473	AI-XC	20131119122053	500	500	W	N	N	F	995361	3	10587535	Y	51802	Stanley is correct because the bottom number is greater so two fourths is greater than two thirds																				
474	AI-XC	20131119122053	500	500	2	N	N	M	995553	3	10587570	Y	51802	on. I say ON bceause 2\3 is biger then 2\4.																				
475	AI-XC	20131119122053	500	500	W	N	N	M	995580	3	10587575	Y	51802	No. 2/4 is less than 2/3. That is because if the denominator is a greater number, then it lowers the actual digit.																				
476	AI-XC	20131119122053	500	500	W	N		M	995741	3	10587621	Y	51802	He is rong because two thirds is has a smaller denominator.If the denominator is smaller and the numerator is larger or the same then it is bigger.																				
477	AI-XC	20131119122053	500	500	NR			M	995758	3	10587626	Y	51802	No, because 2 fourths is 1 half. And 2 thirds is 1 whole and a quarter. So 2 thirds are greater than 2 fourths.																				
478	AI-XC	20131119122053	500	500	A	N	Y	F	995761	3	10587630	Y	51802	no because 4 is greater than 3 so no																				
479	AI-XC	20131119122053	500	500	NR			M	995823	3	10587635	Y	51802	2 4th is greater then 2 3rd becus 2 4th is grreater.																				
480	AI-XC	20131119122053	500	500	H	Y	Y	M	1001574	3	10587672	Y	51802	No, becausa the dawn number have to be the same number.																				
481	AI-XC	20131119122053	500	500	W	N	N	M	1001845	3	10587704	Y	51802	YES he is corect because if you dvide one pie into two forths and onother into two therds  then if you dvide one therd ther is less pices.																				
482	AI-XC	20131119122053	500	500	NR			M	1002412	3	10587708	Y	51802	she is write																				
483	AI-XC	20131119122053	500	500	W			F	1003176	3	10587713	Y	51802	Stanley is wrong.If you had a pizza an you had four slices an you ate two that is bigger.And if you had three slices an ate two that is smaller.																				
484	AI-XC	20131119122053	500	500	H	N	N	M	1003212	3	10587719	Y	51802	stanley is rong because two forths is not graeter than two threerds she put the opset.																				
485	AI-XC	20131119122053	500	500	A	N	Y	F	1003364	3	10587766	Y	51802	stanley is correct beacause 4 is greater than 3																				
486	AI-XC	20131119122053	500	500	A	N	N	M	1003652	3	10587771	Y	51802	No.																				
487	AI-XC	20131119122053	500	500	W	N	N	F	1003868	3	10587777	Y	51802	no because the higher the number the smaler the top number gets.																				
488	AI-XC	20131119122053	500	500	W	N	N	F	1003877	3	10587826	Y	51802	No,he's not correct because the bigger the numarator the smaller it is.																				
489	AI-XC	20131119122053	500	500	NR		Y	F	1004732	3	10587831	Y	51802	Stanley is correct by looking at the buotom  number																				
490	AI-XC	20131119122053	500	500	W	N	N	M	1004932	3	10587838	Y	51802	YES  HE IS																				
491	AI-XC	20131119122053	500	500	W	N	N	M	1005031	3	10587884	Y	51802	yes, 2/3 is larger than 1/2.																				
492	AI-XC	20131119122053	500	500	W		Y	M	1005647	3	10587888	Y	51802	No. because																				
493	AI-XC	20131119122053	500	500	W	N	N	M	1009906	3	10587892	Y	51802	No 3/2 is greater																				
494	AI-XC	20131119122053	500	500	H	N	Y	F	1010636	3	10587898	Y	51802	Stanley is wrong because 2/3 and 2/4 are = to each other.																				
495	AI-XC	20131119122053	500	500	H	N	N	F	1011484	3	10587949	Y	51802	yes.because if you put two fourths together and you compare it to two thirds it is bigger																				
496	AI-XC	20131119122053	500	500	B		N	F	1011897	3	10587955	Y	51802	no he is not 2/4>2/3																				
497	AI-XC	20131119122053	500	500	W	N	N	M	1012599	3	10588004	Y	51802	yes he is because 2-4ths is grater than 2-3eds																				
498	AI-XC	20131119122053	500	500	H	N	N	M	1012621	3	10588008	Y	51802	No,standly is wrong because two forth is smaller spaces because the bottom number is a forth of the space and and the number is smaller and two third is bigger because the there is third of the space and it has bigger space.																				
499	AI-XC	20131119122053	500	500	A	N	N	F	1013222	3	10588012	Y	51802	I think he is wrong because 2/4 is like half and if you draw it 2/3 is greater than half.																				
