	AI_Prov_Name	File_Date	File_Count	Group_Count	Ethnicity	IEP	LEP	Gender	Ven_Stud_ID	Grade	Stud_Test_ID	Score_Flag	Item_ID	Item_Response	Final_Score	Data_Point	Read1_Date	Read1_ID	Read1_Score	Read1_Cond	Read2_Date	Read2_ID	Read2_Score	Read2_Cond	Read3_Date	Read3_ID	Read3_Score	Read3_Cond	Read5_Date	Read5_ID	Read5_Score	Read5_Cond	Alert_Code	Alert_ReaderID
1062	AI-XC	20131002135815	1500	1500	NR			F	597695	8	10211040	Y	46203	In the next few line is a few thing that i do on daily basis.	1		20130820075335	609	1		20130820081641	611	1											
1063	AI-XC	20131002135815	1500	1500	B	N	N	F	597951	8	10211041	Y	46203	What I do now on my free time is...	0		20130819154826	615	0		20130819155146	609	1		20130819162546	625	0							
1064	AI-XC	20131002135815	1500	1500	H	N	Y	M	598284	8	10211043	Y	46203	Although it has its advantages, being vice president might be more than I can handle because I am very busy and have lots of things to do.	2		20130820085853	609	2		20130820090403	616	2											
1065	AI-XC	20131002135815	1500	1500	W	N	N	M	598315	8	10211045	Y	46203	I am always really busy doing stuff.	1		20130820075043	609	1		20130820081220	611	1											
1066	AI-XC	20131002135815	1500	1500	H	Y	Y	M	598332	8	10211047	Y	46203	you can study home	0		20130820083420	609	0		20130820083847	615	0											
1067	AI-XC	20131002135815	1500	1500	W	N	N	F	598374	8	10211049	Y	46203	I would like to run for vice president, but I have many other things that I have to get done.	2		20130819145139	609	2		20130819145526	611	2											
1068	AI-XC	20131002135815	1500	1500	W	N	N	M	598427	8	10211050	Y	46203	But I am unsure if i want to be class vice president because I'm really busy.	2		20130820090934	609	2		20130820091214	611	2											
1069	AI-XC	20131002135815	1500	1500	W	Y	N	M	598445	8	10211052	Y	46203	x	T		20130820112350	77		T	20130820112850	458		T										
1070	AI-XC	20131002135815	1500	1500	NR			M	598529	8	10211054	Y	46203	There are some obstacles I face if I want to become the school vice president.	2		20130820084353	609	2		20130820084909	615	1		20130820134246	625	2							
1071	AI-XC	20131002135815	1500	1500	W	N	N	F	598532	8	10211056	Y	46203	I am a very busy person and i dont think i will have time for vice president between all myt activities.	2		20130820085911	616	1		20130820090132	611	2		20130821083421	609	2							
1072	AI-XC	20131002135815	1500	1500	NR			F	598607	8	10211058	Y	46203	In other words, I am a hard worker, and i will try my best to do what is right for the class.	0		20130820085103	609	0		20130820085332	615	0											
1073	AI-XC	20131002135815	1500	1500	NR			F	598611	8	10211060	Y	46203	Additionally, I have a very busy schedule, so time management would require a lot of effort.	1		20130820091028	609	1		20130820091440	611	1											
1074	AI-XC	20131002135815	1500	1500	W	N	N	M	598804	8	10211062	Y	46203	I also have other stuff I half to do as well in order to get class vice president.	1		20130820074745	609	1		20130820080045	611	2		20130820085139	625	1							
1075	AI-XC	20131002135815	1500	1500	W	N	N	F	598808	8	10211064	Y	46203	I have so much to do in the week.	0		20130819154216	616	0		20130819155147	611	0											
1076	AI-XC	20131002135815	1500	1500	B	Y	N	M	598811	8	10211066	Y	46203	Before deciding whether to run for vice president oo the class, I have a lot to consider.  I work at Brick Ice   Cream every day at 6 a.m. on Saturdays. I all so have my friend who I'm looking forwerd spendtime with this coming year.	0		20130819162514	609	0		20130820074433	616	0											
1077	AI-XC	20131002135815	1500	1500	W	N	N	M	598868	8	10211068	Y	46203	The promises that I can make to you students out there is	0		20130820075850	609	0		20130820082409	611	0											
1078	AI-XC	20131002135815	1500	1500	NR			F	598902	8	10211070	Y	46203	Which is great but I need to think of what to do when I am president and my schedule.	1		20130820081825	615	1		20130820082110	609	1											
1079	AI-XC	20131002135815	1500	1500	W	N	N	F	598915	8	10211072	Y	46203	However, there are some things that I need to consider.	1		20130820104227	616	1		20130820104748	615	1											
1080	AI-XC	20131002135815	1500	1500	H	N	Y	F	598936	8	10211074	Y	46203	i am running for vice president and my friend for president it would be fun to have this opportunity with him, i really have a good chance for this because im doing well in classes and kids know im smart.	0		20130820085210	609	0		20130820085744	615	0											
1081	AI-XC	20131002135815	1500	1500	W	N	N	M	598949	8	10211076	Y	46203	However,	0		20130819162114	615	0		20130819162421	611	0											
1082	AI-XC	20131002135815	1500	1500	W	N	N	F	598956	8	10211077	Y	46203	I dont think I should run if I have no interest in it.	0		20130820091229	609	0		20130820091801	611	0											
1083	AI-XC	20131002135815	1500	1500	B	N	N	F	598978	8	10211079	Y	46203	This could be a way for students who are about to graduate, to have a good review on their records.	0		20130820085911	616	0		20130820090132	611	0											
1084	AI-XC	20131002135815	1500	1500	B	N	Y	F	598979	8	10211081	Y	46203	so i am going to go to my friend next week.	0		20130819160840	611	0		20130819161300	616	0											
1085	AI-XC	20131002135815	1500	1500	W	N	N	F	599001	8	10211084	Y	46203	Do you want me to be vice pres, if so vote.	0		20130819162900	609	0		20130820074847	616	0											
1086	AI-XC	20131002135815	1500	1500	W	N	N	F	599017	8	10211086	Y	46203	both students have to study and practice for there curring event.	0		20130820091845	609	0		20130820092049	615	0											
1087	AI-XC	20131002135815	1500	1500	B			M	599098	8	10211088	Y	46203	They can put although .	0		20130819154747	609	0		20130819155327	615	0											
1088	AI-XC	20131002135815	1500	1500	W			F	599100	8	10211090	Y	46203	The student wants to run for class vice president and heard that colleges are impressed with students that preticipate in student government, But the student is on a full schedual so they are not sure if he/she is interested in politics and political organization.	0		20130820104442	611	0		20130820104726	609	0											
1089	AI-XC	20131002135815	1500	1500	W			F	599146	8	10211092	Y	46203	,Also to let you know	0		20130820083609	609	0		20130820084242	615	0											
1090	AI-XC	20131002135815	1500	1500	NR			M	599196	8	10211094	Y	46203	On my spare time I do many and exiting things like.	1		20130819154826	615	1		20130819155146	609	1											
1091	AI-XC	20131002135815	1500	1500	NR			M	599225	8	10211096	Y	46203	However, I do have some problems in my way	1		20130820095112	609	1		20130820095905	615	1											
1092	AI-XC	20131002135815	1500	1500	W			M	599234	8	10211098	Y	46203	Then	0		20130819161116	609	0		20130819161340	611	0											
1093	AI-XC	20131002135815	1500	1500	NR			F	599463	8	10211099	Y	46203	Even though running for vice president with my best friend would be exciting, i don't think i have the time; i have too much going on.	2		20130819155828	616	2		20130819160028	609	2											
1094	AI-XC	20131002135815	1500	1500	NR			F	599510	8	10211101	Y	46203	It a big reasponceability but i think i could handle it.	1		20130819144343	609	1		20130819145110	615	1											
1095	AI-XC	20131002135815	1500	1500	NR	N		F	599585	8	10211103	Y	46203	Another thing that I must consider before decided to run for vice president is my school work. If I become vice president I won't have as much time to work on my school work, and participate in things that I love to do. I also have to think about my job and extra curricular activities.	0		20130820090408	609	0		20130820090734	611	0											
1096	AI-XC	20131002135815	1500	1500	W	N	N	F	599683	8	10211105	Y	46203	Before deciding to run for vice president I should study more on Biology, but can't find the time sice I have work than swim practice.	0		20130819160948	609	1		20130819161528	615	0		20130820082930	625	0							
1097	AI-XC	20131002135815	1500	1500	NR			F	599764	8	10211107	Y	46203	Running for vice president of the class would be fun and it looks good on college applications, but I am really busy and I don't know if I can do it.	2		20130820090243	609	2		20130820090931	615	2											
1098	AI-XC	20131002135815	1500	1500	NR			M	599772	8	10211109	Y	46203	Now the other side of the decision	1		20130820094641	609	1		20130820095021	616	0		20130821144931	611	1							
1099	AI-XC	20131002135815	1500	1500	NR			M	599794	8	10211111	Y	46203	I am crrentily working right now.	0		20130819155316	616	0		20130819155911	615	0											
1100	AI-XC	20131002135815	1500	1500	NR			F	599863	8	10211113	Y	46203	Those are some of the reasons why I am running for Vice President, now I am going to tell you alottle bit about me and my life.	2		20130820090934	609	1		20130820091214	611	2		20130821140349	625	2							
1101	AI-XC	20131002135815	1500	1500	NR			M	599901	8	10211115	Y	46203	before I go to college	0		20130820095948	609	0		20130820101930	616	0											
1102	AI-XC	20131002135815	1500	1500	W	N	N	F	599974	8	10211117	Y	46203	Before deciding to run for vice president, I have a lot to consider. My best friend is running for president, so it would be fun, and we could spend a lot of time together in the coming year. I am working at Brick Ice Cream on Saturdays; I have swim practice everyday at 6:00 a.m. Biology is a tough class and i need to do a lot of studying to pass it. I am not sure if I am really that interested in politics and political organization.	N		20130822083009	77		N	20130822083509	734		N										
1103	AI-XC	20131002135815	1500	1500	NR			F	599979	8	10211119	Y	46203	I'm deciding if I should run for vice president of the class, I heard that colleges are impressed wiht students who have participated in student government, but right now I have a lot on my plate; like working on Saturdays, swim pratice at 6 a.m. everyday, and about worring to pass Biology.	0		20130820093730	609	0		20130820094503	611	0											
1104	AI-XC	20131002135815	1500	1500	H	Y	N	M	600036	8	10211121	Y	46203	the eqatrer	T		20130820113004	77		T	20130820113504	458		T										
1105	AI-XC	20131002135815	1500	1500	NR			M	600057	8	10211123	Y	46203	But i dont think i would be the right person becuse	0		20130820090514	609	0		20130820091651	616	0											
1106	AI-XC	20131002135815	1500	1500	W	N	N	M	600100	8	10211125	Y	46203	I might not be able to do it because i have lots of stuff to do every day.	1		20130820104824	611	1		20130820110310	609	1											
1107	AI-XC	20131002135815	1500	1500	NR			M	600180	8	10211127	Y	46203	On the other hand, I am really busy too.	1		20130820085650	611	1		20130820085853	609	1											
1108	AI-XC	20131002135815	1500	1500	W	N	N	F	600186	8	10211129	Y	46203	Before I tell you why i want to run vice president let me tell you a little bit about me. I am working at Brick Ice Cream on Saturdays; I have swim practice everyday at 6 a.m. Biology is a tough class and I need to do a lot of studying to pass it. I am not sure if I am really that interested in politics and political organization. Yet before deciding whether to run for vice president of the class, I have a lot to consider. My best friend is running for president, so it would be fun and we could spend a lot of time together in the coming year. I have heard that colleges are impressed with students who have participated in student governement. That's just a little bit about me and why I want to run for vice president.	0		20130820075850	609	0		20130820082409	611	0											
1109	AI-XC	20131002135815	1500	1500	B	N	N	M	600292	8	10211131	Y	46203	School is really important to me, so I will pay attention to school and do extra activites after school.	0		20130819160303	609	0		20130819161059	615	0											
1110	AI-XC	20131002135815	1500	1500	B			F	600480	8	10211133	Y	46203	I am not sure that this is the right move for me. Though, it would be nice I have other things to worry about.	1		20130820082748	609	1		20130820083723	615	1											
1111	AI-XC	20131002135815	1500	1500	NR			F	600997	8	10211135	Y	46203	Then I think about my personal problems and thoughts that might make me uncapeable of doing this job.	2		20130819145329	609	2		20130819145755	611	0		20130819153846	625	2							
1112	AI-XC	20131002135815	1500	1500	H	N	Y	F	601028	8	10211137	Y	46203	First of all, before deciding whether to run for vice president of the class, I have a lot to consider. My best friend is running for president, so it would be fun and we could spend a lot of time together in the coming year. Also, I have heard that colleges are impressed with students who have participated in student government. Further more, I am working at Brick IceCream on Satudays; I have swim practice at 6:00 a.m. Biology is a tough class and I need to do a lot of studying to pass it. I am not sure if I am really that interested in politics and political organization.	0		20130819151129	615	0		20130819151452	609	0											
1113	AI-XC	20131002135815	1500	1500	W	N	N	M	601060	8	10211139	Y	46203	But, being in student government is going to be alot of work, I'd have to add to my already busy schedule.	2		20130819162114	615	2		20130819162421	611	2											
1114	AI-XC	20131002135815	1500	1500	B			M	601277	8	10211140	Y	46203	I want to be in politics, but i might be to bussy after school.	2		20130820085103	609	2		20130820085332	615	2											
1115	AI-XC	20131002135815	1500	1500	W	N	N	M	601379	8	10211142	Y	46203	i dont get what u mean	T		20130820112425	77		T	20130820112925	458		T										
1116	AI-XC	20131002135815	1500	1500	W	N	N	F	601476	8	10211144	Y	46203	What about me?	0		20130820085329	609	0		20130820085940	611	0											
1117	AI-XC	20131002135815	1500	1500	H	N	Y	F	601499	8	10211146	Y	46203	However, i also have things to do for my daily life.	1		20130820104100	609	1		20130820104442	611	1											
1118	AI-XC	20131002135815	1500	1500	A	N	Y	M	601671	8	10211148	Y	46203	I was also the best student in two of my classes. Not only am I smart but also responsible in many ways. I take care of my younger brother and sister, I do my homework correctly and neatly, and I am always organize. Another reason I should run for vice president is because I'm trustworty. I have a job so I can use the money to go to college.	0		20130820091905	615	0		20130820092143	611	0											
1119	AI-XC	20131002135815	1500	1500	A	N	N	F	601675	8	10211149	Y	46203	Before I run for vice president, I would like to consider a few things. First and foremost, my best friend is running for president, so, it would really make it a lot of fun. I am not completely sure if I should run for vice president, but I have heard that the colleges would be very well impressed by those who do. I also struggle with Biology and I need to pass it. Besides that, I do work at Brick Ice Cream on Saturdays,  and do swim practices everyday at 6 a.m.,	0		20130820092445	609	0		20130820092834	611	0											
1120	AI-XC	20131002135815	1500	1500	W	N	N	F	601686	8	10211151	Y	46203	Before deciding whether to run for vice president of the class, i have a lot to consider. My best friend is running for president, so it would be fun and we could spend a lot of time together in the coming year. i have heard that colleges are impressed with students who have particpated in student government. but the only problem is i am working a Brick Ice Cream on Saturdays: i have swim practice every day at 6 a.m. Biology is a tough class and i need to do a lot of studying to pss it. i am not sure if i am really that intrested in politics and political organization.	0		20130820104458	609	0		20130820105254	615	0											
1121	AI-XC	20131002135815	1500	1500	H	N	N	M	601734	8	10211162	Y	46203	after that	0		20130820082358	609	0		20130820083153	615	0											
1122	AI-XC	20131002135815	1500	1500	W	N	N	M	601735	8	10211163	Y	46203	On the other hand.	0		20130819144343	609	0		20130819145110	615	0											
1123	AI-XC	20131002135815	1500	1500	W	N	N	M	601740	8	10211165	Y	46203	It would be great if i eon vice president for my class becuase my best friend and i could still spend alot of time together and colleges are impressed woth student who have participated in student goverment but I working at Brick Ice Cream on saturday; swim practice everyday at 6 a.m. and biology is a really though class and I need to do alot of studying to pass it.	0		20130819161605	611	0		20130819161717	609	0											
1124	AI-XC	20131002135815	1500	1500	A	N	Y	F	601787	8	10211167	Y	46203	whether to run for vice preside of the class and his best friend are running for president too and he think it would be so much fun and they would spend lot of thing togther and the colleges are impressed with students who have particpated in student goverment and the 2 texts this person is working at brick ice cream on staurday and it have swim practice eveyday at 6 and they are noy sure if it realoly that interested in politis and political organization.	0		20130820091523	609	0		20130820092300	616	0											
1125	AI-XC	20131002135815	1500	1500	NR			M	601815	8	10211169	Y	46203	But for now i have a low paying job that will get me started.	0		20130820093454	609	1		20130820093801	615	0		20130821144609	611	0							
1126	AI-XC	20131002135815	1500	1500	A	N	N	F	601836	8	10211171	Y	46203	But when I rethink my choice, I have to think about all my other schedules and plans before deciding.	1		20130819161807	615	2		20130819162115	611	1		20130820083054	625	1							
1127	AI-XC	20131002135815	1500	1500	B	Y	N	M	601951	8	10211173	Y	46203	idk	T		20130820112309	77		T	20130820112809	458		T										
1128	AI-XC	20131002135815	1500	1500	NR			F	602106	8	10211175	Y	46203	"However, there are some ""cons"" about running for class vice president."	2		20130820095948	609	2		20130820101930	616	1		20130821150045	611	2							
1129	AI-XC	20131002135815	1500	1500	W	Y		M	602120	8	10211263	Y	46203	when i consiteringi play sports i dont now if i can be class vice presidint.	1		20130820104824	611	1		20130820110310	609	2		20130821150337	625	1							
1130	AI-XC	20131002135815	1500	1500	W	N	N	M	602295	8	10211265	Y	46203	I would be happy to run for vice president for class but,	0		20130819154216	616	1		20130819155147	611	0		20130819161743	625	0							
1131	AI-XC	20131002135815	1500	1500	W			F	602391	8	10211267	Y	46203	thats not all i am doing.	0		20130820093239	609	1		20130820093602	616	0		20130821144609	611	0							
1132	AI-XC	20131002135815	1500	1500	W	N	N	F	602448	8	10211269	Y	46203	They both really want to run for vice president, youll be able to hang out with your friend more that is running for president and colleges are usuallly impressed with students who have participated in student government, maybe i should go to tutoring for biology and stay after for meetings as being the vice president so i wont have to worry abnout to many events taking place at the same time.	0		20130819161605	611	0		20130819161717	609	0											
1133	AI-XC	20131002135815	1500	1500	A	N	Y	F	602480	8	10211271	Y	46203	Beside working in the school, I also working outside.	1		20130820090934	609	1		20130820091214	611	0		20130821140211	625	1							
1134	AI-XC	20131002135815	1500	1500	NR			F	603156	8	10211272	Y	46203	As for experience I currently have a job.	1		20130820083304	609	1		20130820084009	611	1											
1135	AI-XC	20131002135815	1500	1500	W	N	N	F	603226	8	10211274	Y	46203	which i am interested in.	0		20130820084508	609	0		20130820085010	611	0											
1136	AI-XC	20131002135815	1500	1500	W	N	N	M	603227	8	10211276	Y	46203	I also have some jobs and some personal achievements	1		20130820074919	609	1		20130820081220	611	1											
1137	AI-XC	20131002135815	1500	1500	A			M	604483	8	10211277	Y	46203	However, there are many reasons that class vice president may not be a good job for me.	1		20130819153701	616	1		20130819153910	609	2		20130819155323	625	1							
1138	AI-XC	20131002135815	1500	1500	W	N	N	F	604624	8	10211279	Y	46203	on the other hand...	0		20130819150042	615	0		20130819151103	616	0											
1139	AI-XC	20131002135815	1500	1500	H	N	Y	M	605045	8	10211281	Y	46203	and now	0		20130820085329	609	0		20130820085940	611	0											
1140	AI-XC	20131002135815	1500	1500	W	N	N	M	605107	8	10211283	Y	46203	However, I am very bisy at this point.	1		20130820103850	616	1		20130820104201	611	1											
1141	AI-XC	20131002135815	1500	1500	W	N	N	M	605114	8	10211284	Y	46203	1} i have alot to do think about before deciding to become vice president of the class or other things im not really intersted in.	1		20130820084353	609	0		20130820084909	615	1		20130820134246	625	1							
1142	AI-XC	20131002135815	1500	1500	W	N	N	M	607411	8	10211286	Y	46203	But I am not sure I have any time left in my day for it.	1		20130820100219	609	1		20130820101848	611	1											
1143	AI-XC	20131002135815	1500	1500	W	N	N	F	607517	8	10211288	Y	46203	Everyday of the week their is something important going on,	0		20130820095010	615	0		20130820095549	616	0											
1144	AI-XC	20131002135815	1500	1500	W	Y	N	M	608890	8	10211290	Y	46203	i think we both can change the school	0		20130820085716	609	0		20130820090012	615	0											
1145	AI-XC	20131002135815	1500	1500	W	N		F	609043	8	10211291	Y	46203	Also	0		20130819152913	609	0		20130819153127	615	0											
1146	AI-XC	20131002135815	1500	1500	W	Y	N	M	610461	8	10211293	Y	46203	it was the beasnt	0		20130820084730	609	0		20130820085106	615	0											
1147	AI-XC	20131002135815	1500	1500	W	N	N	F	611456	8	10211295	Y	46203	Thesee are some things you may want to know about me,	1		20130820092428	615	0		20130820092545	609	1		20130821142308	625	1							
1148	AI-XC	20131002135815	1500	1500	I	N	N	F	611567	8	10211297	Y	46203	I really want to be the vice president, but I have other priorities I have to do.	2		20130820103248	611	2		20130820104223	615	2											
1149	AI-XC	20131002135815	1500	1500	W	N	N	M	611929	8	10211299	Y	46203	other than that, i do other things.	1		20130819162130	609	1		20130819162713	611	1											
1150	AI-XC	20131002135815	1500	1500	NR			M	612862	8	10211301	Y	46203	i am working at brick ice cream	0		20130819153534	615	0		20130819153911	611	0											
1151	AI-XC	20131002135815	1500	1500	H			F	612871	8	10211303	Y	46203	I have to go through some courses to run for president.	0		20130819145139	609	0		20130819145526	611	0											
1152	AI-XC	20131002135815	1500	1500	W			M	612877	8	10211305	Y	46203	On the other hand, I have lots of other tasks that I must do.	1		20130820075545	609	1		20130820081920	616	1											
1153	AI-XC	20131002135815	1500	1500	W			M	613093	8	10211307	Y	46203	I am also struggling with some classes and work on Saturdays.	1		20130820091937	609	1		20130820092225	615	1											
1154	AI-XC	20131002135815	1500	1500	W	N		M	613564	8	10211309	Y	46203	you need to have a sentence that makes sence and will be in the middle of the two paragraphs.	0		20130820091845	609	0		20130820092049	615	0											
1155	AI-XC	20131002135815	1500	1500	H	N	N	M	613880	8	10211311	Y	46203	before deciding whether to run for vice president of the class, i have a lot to consider. My bestfriend is running for president , so it would be fun and we can spend a lot of time together in the coming year. I am working at Brick Ice Cream on saturdays,i have swim practice every day at 6 a.m. Biology is a tough class and i need to do a lot of studying to pass it. I am not sure if i am really that interested in politics and political government but i have heard that colleger are impressed with students who have participated in student government.	0		20130819161250	609	0		20130819162628	625	0											
1156	AI-XC	20131002135815	1500	1500	H			F	614087	8	10211313	Y	46203	"""Later i realized"" ... I am working  .. (Second Paragraph)"	0		20130819155828	616	0		20130819160028	609	0											
1157	AI-XC	20131002135815	1500	1500	H			F	614089	8	10211315	Y	46203	on my free time.	0		20130820085716	609	0		20130820090012	615	0											
1158	AI-XC	20131002135815	1500	1500	A			F	614094	8	10211317	Y	46203	I am capable of doing so and much more than just getting experienced in student government.	1		20130819154216	616	0		20130819155147	611	1		20130819161743	625	1							
1159	AI-XC	20131002135815	1500	1500	A		N	M	614293	8	10211319	Y	46203	Before I wanted to run for vice president I had my mind set to it.  My friend was running so that would mean I coud spent more time with him.  Also it would look good on my resum??.  The thing is my schedual is packed.  I work at Brick Ice Cream every Saturday.  I have swim practice daily which starts at 6 AM.  I am studying hard for my biology class and I'm not that fasinated with politics.	0		20130820095505	609	0		20130820100009	616	0											
1160	AI-XC	20131002135815	1500	1500	H	N	N	F	614395	8	10211321	Y	46203	1.during my deciding on whether to run for vice president of the class, i have a lot to consider. 2.in other words, i am working at brick ice cream on saturday;i have swim practice everyday at 6 a.m	0		20130820091523	609	0		20130820092300	616	0											
1161	AI-XC	20131002135815	1500	1500	B	N	N	F	614440	8	10211323	Y	46203	However, I have more important things to tend to.	1		20130819152742	615	2		20130819153438	609	1		20130819155323	625	1							
1162	AI-XC	20131002135815	1500	1500	W	N		F	614470	8	10211325	Y	46203	you should become vice president beacuse of the things you believe and like to do	0		20130820092445	609	0		20130820092834	611	0											
1163	AI-XC	20131002135815	1500	1500	W	N	N	M	614493	8	10211327	Y	46203	Students Today hold it off till their 1eighteen but, today I'm going to apply for a job.	0		20130819155911	615	0		20130819160303	609	0											
1164	AI-XC	20131002135815	1500	1500	H		N	F	614666	8	10211329	Y	46203	he shouldent run for vice president , because he is really busy and needs to improve or study on his biology class instead of trying something hader thjat will take his time away .	0		20130820093106	609	0		20130820093411	611	0											
1165	AI-XC	20131002135815	1500	1500	H		N	F	614721	8	10211331	Y	46203	Well lets get to know me if you guys select me as vice president.	1		20130819162115	611	1		20130819162254	609	2		20130820083054	625	1							
