	AI_Prov_Name	File_Date	File_Count	Group_Count	Ethnicity	IEP	LEP	Gender	Ven_Stud_ID	Grade	Stud_Test_ID	Score_Flag	Item_ID	Item_Response	Final_Score	Data_Point	Read1_Date	Read1_ID	Read1_Score	Read1_Cond	Read2_Date	Read2_ID	Read2_Score	Read2_Cond	Read3_Date	Read3_ID	Read3_Score	Read3_Cond	Read5_Date	Read5_ID	Read5_Score	Read5_Cond	Alert_Code	Alert_ReaderID
423	AI-XC	20131002135815	1500	1500	W	Y	N	F	462705	8	10210227	Y	46203	The class elections are coming up, but before deciding whether to run for vice president of the class, I have to consider alot. My best friend is running for president, so it would be fun. We could spend time together. But I am working at Brink Ice Cream on Saturdays. I have heard taht colleges are impressed with students who have been or participated in student goverment. But Biology is a hard class and I need to do alot of studying to pass it. I am not sure if I'm really that interested in politics and political organization.	0		20130820092101	609	0		20130820092450	611	0											
424	AI-XC	20131002135815	1500	1500	B	N	Y	F	463009	8	10210228	Y	46203	I am not sure if I am reall yt tha tinterested in polictics and political organization, but I have heard that colleges are impressed with students who have participated in student government.	0		20130820075850	609	0		20130820082503	615	0											
425	AI-XC	20131002135815	1500	1500	NR			M	463183	8	10210229	Y	46203	But on the other hand I have to do other stuff.	1		20130819162900	609	1		20130820074847	616	1											
426	AI-XC	20131002135815	1500	1500	W	N	N	F	463786	8	10210230	Y	46203	Although running for vice president of the class, this task is very time consuming, and that may not be time that i have.	2		20130820090514	609	2		20130820091651	616	2											
427	AI-XC	20131002135815	1500	1500	W	N	N	M	463794	8	10210231	Y	46203	But colleges wouldnt be interested in a student that couldnt study and didnt like to practice for his sports teams, they also wouldnt want a student that puts work before school.	1		20130819153701	616	1		20130819153910	609	0		20130819155323	625	1							
428	AI-XC	20131002135815	1500	1500	H	N	N	F	463796	8	10210232	Y	46203	Although I want to do this, I have a lot on my plate already. For example:	2		20130819161717	609	2		20130819162114	615	2											
429	AI-XC	20131002135815	1500	1500	W	N	N	M	464173	8	10210233	Y	46203	Unfortunatly, there are also other reasons why i might not be able to run for vice president.	2		20130820101817	615	2		20130820102209	611	2											
430	AI-XC	20131002135815	1500	1500	W	N	N	M	464709	8	10210234	Y	46203	But I also have a good background in work and school.	1		20130820093559	615	1		20130820093953	616	1											
431	AI-XC	20131002135815	1500	1500	W	N	N	F	464710	8	10210235	Y	46203	Although I really want to be the vice president I'm also very busy.	2		20130820104442	611	2		20130820104726	609	2											
432	AI-XC	20131002135815	1500	1500	W	N	N	F	464713	8	10210236	Y	46203	although it would be fun, i am really bussy and dont know if i could handle it.	2		20130820084508	609	2		20130820085010	611	2											
433	AI-XC	20131002135815	1500	1500	A	Y	Y	M	465804	8	10210237	Y	46203	However, colleges accept students who have had alot of accomplishments on their application to enroll in a university.	1		20130820093239	609	1		20130820093602	616	1											
434	AI-XC	20131002135815	1500	1500	NR			M	465918	8	10210238	Y	46203	So i started thinking about paraticipating in student government.	0		20130820104227	616	1		20130820104748	615	0		20130821083549	609	0							
435	AI-XC	20131002135815	1500	1500	B			F	466047	8	10210239	Y	46203	While I want to impress colleges with me being in student goverment I also have to think about my job and other classes.	2		20130819155316	616	2		20130819155911	615	2											
436	AI-XC	20131002135815	1500	1500	H	N	N	M	466313	8	10210240	Y	46203	and since	0		20130820074223	609	0		20130820075352	611	0											
437	AI-XC	20131002135815	1500	1500	A	Y	Y	M	466439	8	10210241	Y	46203	also i have a job	1		20130820085853	609	1		20130820090403	616	1											
438	AI-XC	20131002135815	1500	1500	H	Y	N	F	466854	8	10210242	Y	46203	next,	0		20130820094641	609	0		20130820095021	616	0											
439	AI-XC	20131002135815	1500	1500	H	Y	Y	F	467487	8	10210243	Y	46203	the first paragraph was about student government and the second paragraph was about working and studying , so both pragraphs are abot deciding in whether particapate in student goverment.	0		20130820100219	609	0		20130820101959	615	0											
440	AI-XC	20131002135815	1500	1500	H	N	Y	M	467755	8	10210244	Y	46203	although	0		20130819162900	609	0		20130820074847	616	0											
441	AI-XC	20131002135815	1500	1500	W	N	N	M	467852	8	10210245	Y	46203	However, I do have a lot of other things that get in the way of my running.	2		20130820084110	609	2		20130820084527	615	2											
442	AI-XC	20131002135815	1500	1500	W			F	468167	8	10210246	Y	46203	But then again, I'm very busy.	1		20130820093158	611	1		20130820093334	609	1											
443	AI-XC	20131002135815	1500	1500	H	Y	N	F	468294	8	10210247	Y	46203	If you are working in a ice cream shop than you could get another job that pays better like running for vice president in your class it dosen't really pay but you could get into a good college.	0		20130820074919	609	0		20130820081220	611	0											
444	AI-XC	20131002135815	1500	1500	NR	N	N	M	468772	8	10210248	Y	46203	But if i was to run for vice president i would have to worry about every thing els that i do outside and inside of  school like for example.	2		20130820090408	609	1		20130820090734	611	2		20130821140211	625	2							
445	AI-XC	20131002135815	1500	1500	H	Y	Y	M	468798	8	10210249	Y	46203	i dont think i can beacus,	0		20130820093619	609	0		20130820094042	615	0											
446	AI-XC	20131002135815	1500	1500	W	N	N	F	468801	8	10210250	Y	46203	I also already have a job and earn money.	1		20130820091350	609	1		20130820091707	615	1											
447	AI-XC	20131002135815	1500	1500	H	N	Y	F	468828	8	10210251	Y	46203	I also have a job and other non-school activities.	1		20130819161431	609	1		20130819161807	615	1											
448	AI-XC	20131002135815	1500	1500	H	N	Y	F	469010	8	10210252	Y	46203	I decied that I am going to run for class president. i decied that i am going to ask friends fromwork and swim practice to help me get voters. i also decied that i will make extra time to study  for biology class.	0		20130820081131	609	0		20130820083221	611	0											
449	AI-XC	20131002135815	1500	1500	W			M	469100	8	10210253	Y	46203	... I have heard that colleges are impressed with students who have participated in student government. Outside of school, I am working at Brick Ice Cream on Saturdays; ...	0		20130820090015	609	0		20130820090408	615	0											
450	AI-XC	20131002135815	1500	1500	H	N	Y	F	469579	8	10210254	Y	46203	Many kids don't want to participate in government so they won't get into the collage that easy because the collage is intrested in the kids who participate in the student government so they get jobs at places to win there own little cash to buy themself stuff.	0		20130820074223	609	2		20130820075352	611	0		20130820085139	625	0							
451	AI-XC	20131002135815	1500	1500	H	N	Y	M	469581	8	10210255	Y	46203	My friend and I think it would be fun running for vice president,but	0		20130820074629	609	0		20130820080045	611	0											
452	AI-XC	20131002135815	1500	1500	H	N	Y	M	469798	8	10210256	Y	46203	I want to run for vice president but,I have too many things to do I am not sure I should run for vice president .	2		20130819154216	616	1		20130819155147	611	2		20130819161743	625	2							
453	AI-XC	20131002135815	1500	1500	I	N	N	M	469833	8	10210257	Y	46203	thats when im going to  work in.	0		20130819151329	609	0		20130819152011	615	0											
454	AI-XC	20131002135815	1500	1500	H	N	N	F	470000	8	10210258	Y	46203	idk	T		20130820164612	77		T	20130820165112	462		T										
455	AI-XC	20131002135815	1500	1500	H		N	M	470026	8	10210259	Y	46203	Im going to tell you a little something about me	1		20130820081512	609	1		20130820083221	611	0		20130820093742	625	1							
456	AI-XC	20131002135815	1500	1500	W	N	N	F	470436	8	10210260	Y	46203	Before you go and chose wheather or not you wanna be a participant in a government activity and school you decided to go work at Bricks Ice Cream and then you would be able to have a little job and be able to get paid and then you could go and participate in a government activity at school.	0		20130819145954	609	0		20130819150307	615	0											
457	AI-XC	20131002135815	1500	1500	A	N	N	M	470451	8	10210261	Y	46203	Despite the fact that colleges are impressed with students who have participated in student government I have a tight schedule I must maintain.	2		20130820091229	609	2		20130820091801	611	2											
458	AI-XC	20131002135815	1500	1500	H	N	N	M	470453	8	10210262	Y	46203	therfore i want to run for president. i think i would be a great candidate because i have some major responsibilities	1		20130820085716	609	1		20130820090012	615	1											
459	AI-XC	20131002135815	1500	1500	P	N	N	M	470455	8	10210263	Y	46203	i like helping children in need.If i have spare time i go voulenteerand hospitals and foter homesand i will do you good as  the vice presidient	0		20130820090132	611	0		20130820090243	609	0											
460	AI-XC	20131002135815	1500	1500	A	N	N	M	470576	8	10210264	Y	46203	I'm a very hard worker and I do have many things I have to attend.	1		20130819145241	611	1		20130819145559	609	1											
461	AI-XC	20131002135815	1500	1500	W			M	470596	8	10210265	Y	46203	I want to run for vice president for class but I am very caught up in other activities. If I really want to become the vice president I will strive to do my best but not get stressed and run down with everything else. I promise to all my extra activities that I will work my hardest in all of them.	0		20130820084947	609	0		20130820085650	611	0											
462	AI-XC	20131002135815	1500	1500	W			M	470642	8	10210266	Y	46203	but there are some other thing why i shouldnt run for vice class president because	0		20130820094024	609	0		20130820094647	616	0											
463	AI-XC	20131002135815	1500	1500	B			M	470749	8	10210267	Y	46203	Though I am interested in joining the student government, I have a lot of activities that may get in the way of student government.	2		20130819162655	609	2		20130820074526	611	2											
464	AI-XC	20131002135815	1500	1500	H			M	470793	8	10210268	Y	46203	Before deciding whether to run for vice president of the class, I have a lot to consider.  I am working at Brick Ice Cream on Saturdays and I have swimming practice everyday at 6 a.m.  Biology is a tough class and I need to do a lot of studying to pass it, but my best friend is running for president, so it would be fun and we can a lot of time together inthe coming year.  I have heard that colleges are impressed with students who have participated in the goverment, but I am not sure if I am really that interested in politics and politcal oranization.	0		20130820075043	609	0		20130820081641	611	0											
465	AI-XC	20131002135815	1500	1500	A	N	N	F	470839	8	10210269	Y	46203	However, I think I'll think about this later, since I'm very busy today.	1		20130819154747	609	1		20130819155327	615	1											
466	AI-XC	20131002135815	1500	1500	A	N	N	F	470982	8	10210270	Y	46203	Although this would look good on a college application, I have quite a busy schedule already.	2		20130820092713	616	2		20130820093050	611	2											
467	AI-XC	20131002135815	1500	1500	H	N	N	M	471160	8	10210271	Y	46203	Before deciding whether to run for vice president of the class, I have alot to consider. My best friend is running for president, so it would be fun and we could spend alot of time together in the coming year. I have heard that colleges are impressed with students who have participasted in student government. The I dont know because I am working at Brick Ice Cream and I have swim practice every day at 6 a.m. Biology is a tough class and I need to do a lot of studying to pass it. I am not sure if i am really that interested I politics and political organization.	0		20130820083951	609	0		20130820084534	611	1		20130820133924	625	0							
468	AI-XC	20131002135815	1500	1500	H	Y	Y	M	471657	8	10210272	Y	46203	deciding whether to run vice president of  the class, I have a lot to consider. my friend is persident, so it would be fun and we spend time a lot of of the time to	0		20130820074223	609	0		20130820075352	611	0											
469	AI-XC	20131002135815	1500	1500	H	N	N	M	471959	8	10210273	Y	46203	they both are talking about colloge because with the better stuff you do like run for a political party then it will go on your college thing.	0		20130820093454	609	0		20130820093801	615	0											
470	AI-XC	20131002135815	1500	1500	W	N	N	M	472009	8	10210274	Y	46203	knk	U		20130820112435	77		U	20130820112935	458		U										
471	AI-XC	20131002135815	1500	1500	H	N	Y	F	472161	8	10210275	Y	46203	to pass the classes we need to join an activity that will help us pass it or at least that will help with the class.	0		20130819153827	615	0		20130819154048	609	0											
472	AI-XC	20131002135815	1500	1500	W	N	N	M	472469	8	10210276	Y	46203	Although, I do not like student government.	1		20130819161605	611	1		20130819161717	609	1											
473	AI-XC	20131002135815	1500	1500	A	N	Y	F	472728	8	10210277	Y	46203	Although it would be a ton of fun to be a vice president, I have many other priorities such as my job at Brick Ice Cream on Saturdays.	1		20130820091523	609	1		20130820092300	616	2		20130821140349	625	1							
474	AI-XC	20131002135815	1500	1500	W	N	N	M	472748	8	10210278	Y	46203	WITH THAT I AM WORKING AT.........	0		20130819161807	615	0		20130819162115	611	0											
475	AI-XC	20131002135815	1500	1500	H	N	N	M	472779	8	10210279	Y	46203	which is why	0		20130820103944	611	0		20130820104232	609	0											
476	AI-XC	20131002135815	1500	1500	W	N	N	F	473156	8	10210280	Y	46203	However, I am working at Brich Ice Cream on Saturdays, I hace swim practice everyday at 6 a.m. Biology is a tough class and i need to do a lot of studying to pass it. Also i am not really that interested in politics and political organization.	0		20130820090015	609	0		20130820090408	615	0											
477	AI-XC	20131002135815	1500	1500	H	N	Y	M	473714	8	10210281	Y	46203	Before they decided who runs for president they  will choose the class goverment	0		20130819162130	609	0		20130819162713	611	0											
478	AI-XC	20131002135815	1500	1500	W	Y	N	M	474161	8	10210282	Y	46203	There is a problem, however, with my schedule.	1		20130820094024	609	1		20130820094608	615	1											
479	AI-XC	20131002135815	1500	1500	A	N	N	F	474521	8	10210283	Y	46203	However, I might not have enough time to be the vice president.	2		20130819152920	615	2		20130819153718	609	2											
480	AI-XC	20131002135815	1500	1500	W	N		F	474569	8	10210284	Y	46203	But student government isnt the only thing I do.	1		20130820094802	615	1		20130820094955	609	2		20130821144931	611	1							
481	AI-XC	20131002135815	1500	1500	H	N	N	M	474724	8	10210285	Y	46203	I also have alot of things to do on the weekends and almost every day.	1		20130820095948	609	1		20130820101930	616	1											
482	AI-XC	20131002135815	1500	1500	W	N	N	M	474909	8	10210286	Y	46203	On the other hand, I don't know if i really want to be in school politics though.	1		20130820095313	611	1		20130820095653	609	1											
483	AI-XC	20131002135815	1500	1500	W		N	M	475127	8	10210287	Y	46203	but the thing is	0		20130819160457	615	0		20130819160751	609	0											
484	AI-XC	20131002135815	1500	1500	H		Y	F	475132	8	10210288	Y	46203	Before deciding whether to run for class president i thought about it since my best friend is running for president. we could be spending time a lot more now. I've been busy though. I am working at Brick Ice Cream on staurdays,go to swim practice everyday at 6 a.m, and have biology class that i need to study so im not sure if polotics is my thing.	0		20130820081635	609	0		20130820082906	616	0											
485	AI-XC	20131002135815	1500	1500	W	N	N	M	475498	8	10210289	Y	46203	I also am trying to hold a job so I can make some money.	1		20130819161604	609	0		20130819161834	611	1		20130820083054	625	1							
486	AI-XC	20131002135815	1500	1500	B	N	N	M	475805	8	10210290	Y	46203		B		20130819150152	616		B	20130819150336	609		B										
487	AI-XC	20131002135815	1500	1500	H	N	N	M	475937	8	10210291	Y	46203	Unfortunately ,there are other things i have to do that take my time away from doing the work a president needs to do.	2		20130819162254	609	2		20130819162824	615	2											
488	AI-XC	20131002135815	1500	1500	NR			M	476039	8	10210292	Y	46203	Before deciding whether to run for vice president of the class.I have swim practice every day at 6 a.m.I am not sure if i am really that interested in politics. I have heard the colleges are impressed withn students who have participatedin student government.	0		20130820084110	609	0		20130820084527	615	0											
489	AI-XC	20131002135815	1500	1500	H	N	N	M	476223	8	10210293	Y	46203	But I am aslo on a time budget with activities after school.	1		20130819155840	609	1		20130819160457	615	1											
490	AI-XC	20131002135815	1500	1500	H	N	N	M	476369	8	10210294	Y	46203	But I think my running candidate wouldn't be the best choice for class vice president.	0		20130819161154	611	1		20130819162043	616	0		20130820082930	625	0							
491	AI-XC	20131002135815	1500	1500	W		N	F	476653	8	10210295	Y	46203	Although, I'm not sure I'll have enough time to focus on it with a busy schedule like mine.	2		20130820085329	609	1		20130820085940	611	2		20130821140051	625	2							
492	AI-XC	20131002135815	1500	1500	H	N	N	F	476680	8	10210296	Y	46203	I want to become vice president even though my schedule is full already.	2		20130819151329	609	2		20130819151740	615	2											
493	AI-XC	20131002135815	1500	1500	H	N	Y	M	476828	8	10210297	Y	46203	I would like to be class vice president because I really work hard in classes.	0		20130820081825	615	0		20130820082110	609	0											
494	AI-XC	20131002135815	1500	1500	W	N	N	M	476964	8	10210298	Y	46203	I have also done other things to try to inpress colleges.	1		20130820093901	611	0		20130820094311	609	1		20130821144552	625	1							
495	AI-XC	20131002135815	1500	1500	H	N	N	F	477108	8	10210299	Y	46203	you can make some time for the election and for vice president and its ok if your not interested in poitics and political organization you can still run for vice president.	0		20130820091845	609	0		20130820092049	615	0											
496	AI-XC	20131002135815	1500	1500	H	N	Y	M	477112	8	10210300	Y	46203	To get excepted to a good college i have to work hard and not give up.	0		20130819151720	609	0		20130819153701	616	0											
497	AI-XC	20131002135815	1500	1500	W	N	N	F	477182	8	10210301	Y	46203	CR	U		20130820112414	77		U	20130820112914	458		U										
498	AI-XC	20131002135815	1500	1500	NR			F	477276	8	10210302	Y	46203	I also have a lot of different activities going on right now, and I do not know when I would have time.	1		20130820092713	616	1		20130820093050	611	1											
499	AI-XC	20131002135815	1500	1500	W	N	N	F	477404	8	10210303	Y	46203	Although I have many interests in the program, I have a very busy schedule that I may not be able to compromise with.	2		20130820084730	609	1		20130820085106	615	2		20130821135308	625	2							
500	AI-XC	20131002135815	1500	1500	W	N	N	F	477484	8	10210304	Y	46203	but on the other hand i have a very busy schedule and running for vice president would definitley get in the way, considering:	2		20130820084221	609	1		20130820084646	616	2		20130820133924	625	2							
501	AI-XC	20131002135815	1500	1500	A	N	N	F	477506	8	10210305	Y	46203	But, there are many other tasks I need to complete.	1		20130819162514	609	1		20130820074433	616	1											
502	AI-XC	20131002135815	1500	1500	W	N	N	F	477540	8	10210306	Y	46203	i do many things in the comminuty to help also im decated in my school work.	0		20130820090015	609	0		20130820090408	615	0											
503	AI-XC	20131002135815	1500	1500	B	N	N	M	477816	8	10210307	Y	46203	But this journal entry isn't about me and my friend,its about me trying my best to win vice president!	0		20130819162655	609	0		20130820074526	611	0											
504	AI-XC	20131002135815	1500	1500	B	N	N	F	477818	8	10210308	Y	46203	Before deciding whether to run for vice president of the class, I have a really tough schedule and have little interest in political organization. On a happy note, I have a lot to consider about helping out my best friend who is the best president. I am not the best in Biology but I will study hard to pass the class and to be the best vice president the school has ever had. I have heard that colleges are impressed with students who are involved with student government, and I will put my best effort into being the most involved student in politics.	0		20130819161300	616	0		20130819161431	609	0											
505	AI-XC	20131002135815	1500	1500	B	N	N	F	477976	8	10210309	Y	46203	I have alot to consider about running for vice president, but i heard that colleges are impressed with students who have participated in student government. I also work at Brick Ice Cream on Saturday and have other work to do, if i want to pass biology.	0		20130820091229	609	0		20130820091801	611	0											
506	AI-XC	20131002135815	1500	1500	NR	N		M	477979	8	10210310	Y	46203	There is a lot of responsablility that comes with being in the school's government.	0		20130820090243	609	0		20130820090734	611	0											
507	AI-XC	20131002135815	1500	1500	NR			M	478263	8	10210311	Y	46203	And I do these things.	1		20130819155013	609	1		20130819155539	611	1											
508	AI-XC	20131002135815	1500	1500	NR			M	478554	8	10210312	Y	46203	And I even work at ice cream shop.	0		20130820095505	609	0		20130820100009	616	0											
509	AI-XC	20131002135815	1500	1500	W	N	N	M	478568	8	10210313	Y	46203	Although being vice president would be fun, I have some other obligations I have to keep.	2		20130820074422	609	2		20130820075711	616	2											
510	AI-XC	20131002135815	1500	1500	H	Y	Y	F	478666	8	10210314	Y	46203	He is running for vice president. He has lots of things going on. His runnind for vice president, works at Brick Ice Cream, has swimmig practice everyday at 6 a.m. He needs to study more for biology because its his toughest class. He now doesnt now if hes intrested in politics and political organization.	0		20130820081512	609	0		20130820083221	611	0											
511	AI-XC	20131002135815	1500	1500	H	N	Y	M	478667	8	10210315	Y	46203	I have heard that colleges re impressed with students who have participated in student government, but I am working at Brick Ice Cream on Satrudays; I have swim pratice every day at 6 a.m. Biology is a class and I need to do a lot of studing to pass it.	0		20130820104824	611	0		20130820110310	609	0											
512	AI-XC	20131002135815	1500	1500	W	N	N	F	478672	8	10210316	Y	46203	However, I do have some concerns about me running for vice president of my class.	1		20130819162018	609	1		20130819162501	615	2		20130820085006	625	1							
513	AI-XC	20131002135815	1500	1500	W	N	N	F	478760	8	10210317	Y	46203	The government also like student and children at work.	0		20130820095653	609	1		20130820101817	615	0		20130821150045	611	0							
514	AI-XC	20131002135815	1500	1500	NR			F	478807	8	10210318	Y	46203	Altough I have many other responsibilities, tha i need give my best effort to.	1		20130819153910	609	1		20130819154220	611	1											
515	AI-XC	20131002135815	1500	1500	NR			M	478809	8	10210319	Y	46203	First you need to show you work ethic.	1		20130820074629	609	0		20130820080045	611	1		20130820085139	625	1							
516	AI-XC	20131002135815	1500	1500	NR			M	478877	8	10210320	Y	46203	I would of ran for vice president. Also if you dont do political organization then it wouldnt be good because most of that can help you.	0		20130820095313	611	0		20130820095653	609	0											
517	AI-XC	20131002135815	1500	1500	B			M	478921	8	10210321	Y	46203	But i do have something more important to do.	1		20130819152742	615	2		20130819153438	609	1		20130819155323	625	1							
518	AI-XC	20131002135815	1500	1500	W	Y	N	F	479049	8	10210322	Y	46203	before  deciding weather  to  run for  vice  president  of the  class . i have  a lot  to consider. my  best  friend  is running  for  presintd to  .	0		20130820084617	625	0		20130820085029	616	0											
519	AI-XC	20131002135815	1500	1500	W			F	479153	8	10210323	Y	46203	But I also have a lot of other responsiblity's to think about.	1		20130820091028	609	1		20130820091440	611	1											
520	AI-XC	20131002135815	1500	1500	NR			M	479226	8	10210324	Y	46203	Here are some things that could get in the way of me becoming vice president of the class.	1		20130819154220	611	1		20130819155013	609	2		20130819162546	625	1							
521	AI-XC	20131002135815	1500	1500	NR			M	479229	8	10210325	Y	46203	both students both want one thing.	0		20130819160948	609	0		20130819161528	615	0											
522	AI-XC	20131002135815	1500	1500	NR			F	479247	8	10210326	Y	46203	he wants to run for vice president and he has to work on saturdays and his biology class is hard	0		20130820103850	616	0		20130820104201	611	0											
523	AI-XC	20131002135815	1500	1500	H	N	N	F	479274	8	10210327	Y	46203	but in the mean time,	0		20130820093901	611	0		20130820094311	609	0											
524	AI-XC	20131002135815	1500	1500	A	N	N	F	479392	8	10210328	Y	46203	Although I want to impress my future colleges, I have a busy schedule.	2		20130819161841	609	2		20130819162529	616	2											
525	AI-XC	20131002135815	1500	1500	W	N	N	M	479449	8	10210329	Y	46203	On the downside I have other things to do.	1		20130820104824	611	1		20130820110310	609	1											
