	AI_Prov_Name	File_Date	File_Count	Group_Count	Ethnicity	IEP	LEP	Gender	Ven_Stud_ID	Grade	Stud_Test_ID	Score_Flag	Item_ID	Item_Response	Final_Score	Data_Point	Read1_Date	Read1_ID	Read1_Score	Read1_Cond	Read2_Date	Read2_ID	Read2_Score	Read2_Cond	Read3_Date	Read3_ID	Read3_Score	Read3_Cond	Read5_Date	Read5_ID	Read5_Score	Read5_Cond	Alert_Code	Alert_ReaderID
0	AI-XC	20131002135815	1500	1500	H	N	Y	M	361275	8	10209804	Y	46203	Another thing is...	0		20130820090612	609	0		20130820091030	611	0											
1	AI-XC	20131002135815	1500	1500	H	N	N	F	361286	8	10209805	Y	46203	On the other hand, I have a busy schedule and might not be able to comit.	1		20130820083304	609	1		20130820084009	611	1											
2	AI-XC	20131002135815	1500	1500	W	N	N	F	361330	8	10209806	Y	46203	Due to all the extra curicular work I do I thought I had a shot.	1		20130820101556	611	1		20130820101902	609	1											
3	AI-XC	20131002135815	1500	1500	W	N	N	M	361335	8	10209807	Y	46203	they are both competing and yet only one might drop out because number 2 seems to be booked and needs to do a lot.	0		20130820103248	611	0		20130820104223	615	0											
4	AI-XC	20131002135815	1500	1500	W			M	361426	8	10209808	Y	46203	My best friend is running for class president, i also want to,but  I work on saturdays, and I have swim practice every day at 6 a.m. biology is hard I might not be able to join, and im not that instrested in political organization.	0		20130820083304	609	0		20130820084009	611	0											
5	AI-XC	20131002135815	1500	1500	NR	N	Y	M	361456	8	10209809	Y	46203	student government and	0		20130820104824	611	0		20130820110310	609	0											
6	AI-XC	20131002135815	1500	1500	NR			M	361482	8	10209810	Y	46203	Here is some things about me.	0		20130820093559	615	0		20130820093953	616	0											
7	AI-XC	20131002135815	1500	1500	W	N	N	M	361609	8	10209811	Y	46203	Running for student government is a great thing to get into, colleges are always looking for people part of the student government because it teaches the way government works. However, if your schedule is to packed and you may not be that interested in it, don't join.	0		20130820092341	609	0		20130820092627	615	0											
8	AI-XC	20131002135815	1500	1500	NR			F	361682	8	10209812	Y	46203	Although I am quite busy most of the weekdays and weekends.	1		20130820081131	609	1		20130820082440	616	1											
9	AI-XC	20131002135815	1500	1500	H	N	Y	M	361699	8	10209813	Y	46203	They are saying that it will be fun because my friend is also running for school president and that colleges are in impressed with kids who participated in school government and also I have swimming practice at six in the mornning and i am working in a ice cream shop.	0		20130820091028	609	0		20130820091440	611	0											
10	AI-XC	20131002135815	1500	1500	H			M	361843	8	10209814	Y	46203	The two paragraphs have two people that have alot to do.	0		20130820104458	609	0		20130820105254	615	0											
11	AI-XC	20131002135815	1500	1500	B	Y		F	361875	8	10209815	Y	46203	the boy bestfriend is going to vote for the vice president instead of running away	0		20130820091937	609	0		20130820092225	615	0											
12	AI-XC	20131002135815	1500	1500	W	N	N	M	361968	8	10209816	Y	46203	Although I do have other things going on after school.	1		20130820103850	616	1		20130820104201	611	1											
13	AI-XC	20131002135815	1500	1500	NR			F	362024	8	10209817	Y	46203	Before deciding whether to run for vice president of the class, I have a lot to consider. My best friend is running for president, so it would be fun and we could spend a lot of time together in the coming. I have heard that colleges are impressed with students who have participated in student government. Furthermore, I am working at Brick Ice Cream on Saturdays; I have swim practice everyday at 6 a.m. Biology is a tough class and I need to do a lot of studying to pass it. I am not sure if I am really that interested in politics and political organization.	0		20130819145616	615	0		20130819151309	611	1		20130819153846	625	0							
14	AI-XC	20131002135815	1500	1500	NR			F	362030	8	10209818	Y	46203	I am a busy student, but would be willing to work hard to become the vice president.	2		20130820103944	611	2		20130820104232	609	2											
15	AI-XC	20131002135815	1500	1500	H	N	Y	M	362046	8	10209819	Y	46203	both of these students have trouble with there schedules	0		20130819161431	609	0		20130819161807	615	0											
16	AI-XC	20131002135815	1500	1500	NR			M	362163	8	10209820	Y	46203	i am deciding whether to become class president because i do not really like that much about political organization so right now i am debated to run for president or not.	0		20130820083731	609	0		20130820084416	616	0											
17	AI-XC	20131002135815	1500	1500	H	Y	Y	F	362173	8	10209821	Y	46203	They were desciding if he wanted to become vice president of the class and he works at Brick Ice Cream on saturday.	0		20130819151103	616	0		20130819151452	609	0											
18	AI-XC	20131002135815	1500	1500	W	Y	N	M	362218	8	10209822	Y	46203	I have alot of stoff to do.	0		20130819161807	615	0		20130819162115	611	0											
19	AI-XC	20131002135815	1500	1500	H	N	N	F	362227	8	10209823	Y	46203	Furthermore, I have many things that occur after school.	1		20130820094608	615	1		20130820094804	609	1											
20	AI-XC	20131002135815	1500	1500	H	N	N	F	362341	8	10209824	Y	46203	Right now I have a lot of things going on, school wise and out of school as well.	1		20130819155340	609	1		20130819160525	611	1											
21	AI-XC	20131002135815	1500	1500	H	Y	N	F	362370	8	10209825	Y	46203	that they both are running for president amd vice president.	0		20130820104227	616	0		20130820104748	615	0											
22	AI-XC	20131002135815	1500	1500	W	N	N	M	362385	8	10209826	Y	46203	I have to get u early on Thursday's for boxing classes. I have to wake up at 7:00 every Thursday and stay there for 3 hours. I like boxing so it is not a problem for me.	0		20130820075043	609	0		20130820081641	611	0											
23	AI-XC	20131002135815	1500	1500	H	N	N	M	362445	8	10209827	Y	46203	I AM WORKING AT BRICK ICE CREAM ON SATURDAYS	0		20130819161841	609	0		20130819162529	616	0											
24	AI-XC	20131002135815	1500	1500	H	N	N	M	362447	8	10209828	Y	46203	Also	0		20130820091743	609	0		20130820091921	611	0											
25	AI-XC	20131002135815	1500	1500	NR			M	362456	8	10209829	Y	46203	I even have a job.	0		20130819145329	609	1		20130819145755	611	0		20130819153846	625	0							
26	AI-XC	20131002135815	1500	1500	H	N	N	M	362519	8	10209830	Y	46203	I have heard that colleges are impressed with students who have participated in student government. However, I am working at Brink Ice Cream on Saturdays; I have swimming practice every day at 6 a.m.	0		20130820081131	609	0		20130820082440	616	0											
27	AI-XC	20131002135815	1500	1500	H	N	Y	M	362546	8	10209831	Y	46203	I think that the students who have participated on government.	0		20130820085853	609	0		20130820090403	616	0											
28	AI-XC	20131002135815	1500	1500	H	N	N	M	362647	8	10209832	Y	46203	Although, I have some promblems.	1		20130820083731	609	1		20130820084416	616	1											
29	AI-XC	20131002135815	1500	1500	W	N	N	M	362682	8	10209833	Y	46203	%25%26%3f3d	U		20130820164727	77		U	20130820165227	462		U										
30	AI-XC	20131002135815	1500	1500	H	N	Y	F	362698	8	10209834	Y	46203	He works at Brick Ice Cream. He is a hard worker.	0		20130820091937	609	0		20130820092225	615	0											
31	AI-XC	20131002135815	1500	1500	H	N	Y	M	362700	8	10209835	Y	46203	My competer is about to adress you now folk.	0		20130819150336	609	0		20130819151740	615	0											
32	AI-XC	20131002135815	1500	1500	W	N	N	F	362774	8	10209836	Y	46203	i heave heard that colleges are impressed with students who have participated in student government. therefore, i am working at brick ice cream on saturdays;...	0		20130819161841	609	0		20130819162529	616	0											
33	AI-XC	20131002135815	1500	1500	W	N	N	F	363056	8	10209837	Y	46203	Here are some extra curricular activities that i do durring my spare time,and some of my weakneses and dslikes of mine.	1		20130819161604	609	1		20130819161834	611	0		20130820083054	625	1							
34	AI-XC	20131002135815	1500	1500	W	N	N	F	363249	8	10209838	Y	46203	I am very busy these days, though, with my job, school, and extra-carricular activities.	1		20130819150042	615	2		20130819151103	616	1		20130819154047	625	1							
35	AI-XC	20131002135815	1500	1500	B	N	N	F	363255	8	10209839	Y	46203	I do not know what my decisions will lead up to, but I know I need to think wisely about my decision. I have to focus on school and on what i really want to do.	0		20130820094641	609	0		20130820095021	616	0											
36	AI-XC	20131002135815	1500	1500	NR			M	363350	8	10209840	Y	46203	I have lots of things that I have to do,but I also have to pass Biology.Ican not do all those things at once.	0		20130820083731	609	0		20130820084416	616	0											
37	AI-XC	20131002135815	1500	1500	W	N	N	F	363486	8	10209841	Y	46203	In the first paragraph the student seems a lot more interested in student government. But in the second paragraph the student seems less likely to run for student government.	0		20130819161116	609	0		20130819161340	611	0											
38	AI-XC	20131002135815	1500	1500	B	N	N	F	363534	8	10209842	Y	46203	I think that there has to be more things that colleges are impresses with.	0		20130820095652	611	0		20130820095828	609	0											
39	AI-XC	20131002135815	1500	1500	NR	N	N	F	363699	8	10209843	Y	46203	The approite transitional word to connect these two paragraphs should be, Although.	0		20130820102108	609	0		20130820102833	615	0											
40	AI-XC	20131002135815	1500	1500	W	N	N	F	363749	8	10209844	Y	46203	I am a somewhat busy person .	1		20130820084730	609	1		20130820085106	615	0		20130821135308	625	1							
41	AI-XC	20131002135815	1500	1500	H			F	363760	8	10209845	Y	46203	However runing for vice president can bring up a couple struggles and difficulties in my everyday schedule because.	1		20130820093239	609	1		20130820093602	616	1											
42	AI-XC	20131002135815	1500	1500	NR	N	N	F	364123	8	10209846	Y	46203	Although I might not have the time to be the Vice President.	2		20130820075545	609	2		20130820081920	616	2											
43	AI-XC	20131002135815	1500	1500	W	N	N	M	364218	8	10209847	Y	46203	Not only that I have a lot of business experience.	0		20130820091905	615	0		20130820092143	611	0											
44	AI-XC	20131002135815	1500	1500	W	N	N	M	364685	8	10209848	Y	46203	Know I will tell you about myself.	0		20130820093239	609	1		20130820093602	616	0		20130821144609	611	0							
45	AI-XC	20131002135815	1500	1500	W	Y	N	F	364709	8	10209849	Y	46203	The girl wants to be president, and she workd at the Brick Ice Cream shop.	0		20130819155340	609	0		20130819160525	611	0											
46	AI-XC	20131002135815	1500	1500	W	Y	N	M	364815	8	10209850	Y	46203	I do, however, have a few reasons why I do not want to run for class president.	2		20130820104458	609	2		20130820105254	615	2											
47	AI-XC	20131002135815	1500	1500	B	N	N	F	364910	8	10209851	Y	46203	Yet, colleges may not want to have me enrolled in their institution.	0		20130819151129	615	0		20130819151452	609	0											
48	AI-XC	20131002135815	1500	1500	A	N	N	F	364976	8	10209852	Y	46203	However, I don't think I'll have the time to run for vice president or handle the responsibilities of being selected.	2		20130820085716	609	2		20130820090012	615	2											
49	AI-XC	20131002135815	1500	1500	W	N	N	F	365028	8	10209853	Y	46203	But I have a lot of things that I do during the day.	1		20130819160457	609	1		20130819160840	611	1											
50	AI-XC	20131002135815	1500	1500	B			M	365052	8	10209854	Y	46203	However, i am very busy.	1		20130820102108	609	1		20130820102833	615	1											
51	AI-XC	20131002135815	1500	1500	W			M	365116	8	10209855	Y	46203	just incase youre wondering.	0		20130820100219	609	0		20130820101959	615	0											
52	AI-XC	20131002135815	1500	1500	W	N	N	F	365234	8	10209856	Y	46203	I'm just so busy i dont know if i should or should not run for vice president.	1		20130820085210	609	2		20130820085744	615	1		20130821135308	625	1							
53	AI-XC	20131002135815	1500	1500	NR			F	365399	8	10209857	Y	46203	Before deciding whether or not I want to do politics and political organization. I would like to say that I have to work at Brick Ice Cream on Saturdays, I have to go to swim practice everyday at 6 a.m., I also have to study for my Biology class to pass it. But I have heard that colleges are impressed with a student who has praticipated in extra actives so I may still be into doing them both.	0		20130819162655	609	0		20130820074526	611	0											
54	AI-XC	20131002135815	1500	1500	NR			F	365411	8	10209858	Y	46203	Although, I am working at Brick Ice Cream on Saturdays; I also have swim practice every day at 6 a.m.	1		20130819145954	609	0		20130819150307	615	1		20130819154047	625	1							
55	AI-XC	20131002135815	1500	1500	W	N	N	F	365446	8	10209859	Y	46203	Before deciding weather to run for class vice president i need to consider i am working at Bricks Ice Cream shop on saturdays, also i have swiming practice at 6 am every day, and biology is really tough which requiers alot of studying to pass. The best part about running for vice president is my best friend is running to so we get to spend a whole bunch of time together, and if i do run it can help towards my grades, because collages are impressed by students who have participated in student goverment. I have alot to consider, and really thing about it.	0		20130820091937	609	0		20130820092225	615	0											
56	AI-XC	20131002135815	1500	1500	W	Y	N	M	365616	8	10209860	Y	46203	taking your bestfriend out to eat ice cream at 6 a.m.	0		20130820101724	609	0		20130820102608	616	0											
57	AI-XC	20131002135815	1500	1500	NR			F	365795	8	10209861	Y	46203	However, will I even have time to be vice president?	2		20130820090243	609	2		20130820090931	615	2											
58	AI-XC	20131002135815	1500	1500	B	N	N	M	365804	8	10209862	Y	46203	I have alot to consider before i can make any decisions.	0		20130819154216	616	0		20130819155147	611	1		20130819161743	625	0							
59	AI-XC	20131002135815	1500	1500	NR			F	365826	8	10209863	Y	46203	Before deciding whether to run for vice president of the class, I have a lot to consider. my best friend is runninf for president, so it would be fun and we could spend a lot of time together in the coming year. I have heard that colleges are impressed with students who have participated in student government. Although, I am working at Brick Ice Cream on Saturdays; I have swim practice every day at 6 a.m. Also biology is a tough class and I need to do a lot of studying to pass it. I am not sure if I am really that interested in poliyics and political organizations.	0		20130820075545	609	0		20130820081920	616	0											
60	AI-XC	20131002135815	1500	1500	NR			M	365938	8	10209864	Y	46203	I would like to run for vice president, eventhough my friend is running for president.	0		20130819155828	616	0		20130819160028	609	0											
61	AI-XC	20131002135815	1500	1500	NR			M	365960	8	10209865	Y	46203	I think running for vice president will be fun beacuse my best friend is running for president and it will be a lot of fun, but I work at Brick Ice Cream on Saturdays and I have swimming practice every day at 6 a.m. and not to mention Biology s getting harder and I need to study if I want to pass it. I don't know if I should run for Vice President with my tight scedual.	0		20130820082530	609	0		20130820083723	615	0											
62	AI-XC	20131002135815	1500	1500	W	N	N	M	366923	8	10209866	Y	46203	In my spare time, I am working at Brick Ice Cream on Saturdays.	0		20130820100113	609	0		20130820101848	611	0											
63	AI-XC	20131002135815	1500	1500	P	N	N	M	367110	8	10209867	Y	46203	Approriate transitional statement.	N		20130820164723	77		N	20130820165223	462		N										
64	AI-XC	20131002135815	1500	1500	W	N	N	M	367268	8	10209868	Y	46203	but i do have alot of other things to do	1		20130820092341	609	1		20130820092627	615	1											
65	AI-XC	20131002135815	1500	1500	A	N	N	F	368099	8	10209869	Y	46203	I tend to be a busy person, with balancing school and work throughout my day, but I'm not sure whether of not I should run for vice president to spend time with my best friend and achieve some benefits.	1		20130820102209	615	1		20130820102859	611	1											
66	AI-XC	20131002135815	1500	1500	B	Y		F	369746	8	10209870	Y	46203	Also	0		20130820090529	611	0		20130820090705	609	0											
67	AI-XC	20131002135815	1500	1500	W	N	N	M	370078	8	10209871	Y	46203	There is also my commitments outside of school, and also my schoolwork in general. Is this really a good idea?	1		20130820095112	609	1		20130820095905	615	1											
68	AI-XC	20131002135815	1500	1500	B			M	373971	8	10209872	Y	46203	??????	T		20130820112236	77		T	20130820112736	458		T										
69	AI-XC	20131002135815	1500	1500	W	N	N	M	374112	8	10209873	Y	46203	both of these people are unsure about what to do	0		20130820094804	609	0		20130820095258	615	0											
70	AI-XC	20131002135815	1500	1500	W			M	374178	8	10209874	Y	46203	He thinks that it would be really fun to run for Vice President because his best friend is running for President. He also is struggling in some classes so it  could be hard for him to make it.	0		20130820084110	609	0		20130820084527	615	0											
71	AI-XC	20131002135815	1500	1500	W			F	374179	8	10209875	Y	46203	I also have a job, which is good responsiability	1		20130819155340	609	1		20130819160525	611	1											
72	AI-XC	20131002135815	1500	1500	W	N	N	F	374807	8	10209876	Y	46203	Before I run for vice president, I also have to consider the other things i am doing right now, too.	2		20130820093158	611	2		20130820093334	609	2											
73	AI-XC	20131002135815	1500	1500	H			M	374975	8	10209877	Y	46203	Ok so people now these days do not like politics and some do like them. Also they dont have very much time to have fun and hang out. But maybe wouldnt it be nice to relax and get to together.	0		20130820085716	609	0		20130820090012	615	0											
74	AI-XC	20131002135815	1500	1500	W			M	375496	8	10209878	Y	46203	Before deciding whether to run for vice president of the class. I have a lot to consider. My best friend is running for president, so it would be fun and we could spend a lot of time together in the coming year. I have heard that colleges are impressed with students who have particitpated in student goverment. Right now I am working at Brick Ice Cream on Saturdays; I have swim practice every day at 6 a.m. Biology is a tough class and I need to do a lot of studying to pass it. I am not sure if I am really that interested in politics and political organization.	0		20130820082300	625	0		20130820082530	609	0											
75	AI-XC	20131002135815	1500	1500	B	Y		M	376693	8	10209879	Y	46203	With my job at Brick Ice Cream, swim practice at 6 a.m., and my Biology class I don't think i will have time for being class vice president this year with my best friend.	0		20130820090134	609	0		20130820090643	616	0											
76	AI-XC	20131002135815	1500	1500	W	N	N	F	376777	8	10209880	Y	46203	Also most colleges look at if you have every had a job or had any other credits in your file.	1		20130820093559	615	1		20130820093953	616	1											
77	AI-XC	20131002135815	1500	1500	W		N	M	376854	8	10209881	Y	46203	I am trying to find time to campaign but I'm also really busy.	2		20130819160948	609	2		20130819161528	615	1		20130820082930	625	2							
78	AI-XC	20131002135815	1500	1500	W		N	M	376858	8	10209882	Y	46203	presdants hav bg eers soe dey nkow lotts	0		20130820081825	615	0		20130820082110	609	0											
79	AI-XC	20131002135815	1500	1500	H	N	Y	F	376934	8	10209883	Y	46203	during the time iam	0		20130819162130	609	0		20130819162713	611	0											
80	AI-XC	20131002135815	1500	1500	A		N	F	377096	8	10209884	Y	46203	My schedule might be filled but I am apart of the following activities:	1		20130819155654	609	1		20130819160209	615	0		20130820082756	625	1							
81	AI-XC	20131002135815	1500	1500	NR		N	F	377152	8	10209885	Y	46203	I	U		20130820164732	77		U	20130820165232	462		U										
82	AI-XC	20131002135815	1500	1500	H		N	F	377261	8	10209886	Y	46203	I am a very hard working person & i would do anything to help everyone tand becoming a good vice president at my school .	0		20130820090408	609	2		20130820090734	611	0		20130821140211	625	0							
83	AI-XC	20131002135815	1500	1500	H		N	F	377267	8	10209887	Y	46203	To be vice president would require my time and im actually not really into politics	1		20130820090243	609	1		20130820090931	615	1											
84	AI-XC	20131002135815	1500	1500	NR	N	N	M	377403	8	10209888	Y	46203	Although being vice president would be an exciting experience, I still would need to keep my priorities straight.	2		20130820092844	609	2		20130820093323	616	2											
85	AI-XC	20131002135815	1500	1500	NR			M	377482	8	10209889	Y	46203	He/she should not run for president because he/she has to do a lot of things already.	0		20130820095652	611	0		20130820095828	609	0											
86	AI-XC	20131002135815	1500	1500	W		N	F	377845	8	10209890	Y	46203	Hdhur. hthoghiehgkoifjpwgjogbvuofj. hwghohihfkkdnugv. fhwighgibgabyyew pjfwhihehffhvim,.,olvjeohoej	U		20130820112643	77		U	20130820113143	458		U										
87	AI-XC	20131002135815	1500	1500	W	Y		M	377867	8	10209891	Y	46203	ice cream taste good	0		20130820095652	611	0		20130820095828	609	0											
88	AI-XC	20131002135815	1500	1500	W	N		M	378094	8	10209892	Y	46203	It doesn't make sense that you want to run for vice president because your friend is running for president,when you're not really interested in polotics	0		20130820091028	609	0		20130820091440	611	0											
89	AI-XC	20131002135815	1500	1500	H		N	M	378338	8	10209893	Y	46203	sadly	0		20130819145329	609	0		20130819145755	611	0											
90	AI-XC	20131002135815	1500	1500	W		N	F	379753	8	10209894	Y	46203	Yet, Im not sure I can handle it along with everything else I have going on.	1		20130820084353	609	1		20130820084909	615	2		20130820134246	625	1							
91	AI-XC	20131002135815	1500	1500	H	N	N	M	380562	8	10209895	Y	46203	it is fun working with your freinds but you do noy know if you ar really that intrested on the stuff you would have to be working on	0		20130820085210	609	0		20130820085744	615	0											
92	AI-XC	20131002135815	1500	1500	W	N	N	M	380571	8	10209896	Y	46203	I am already very busy and I don't think I can manage everything with being in student government.	2		20130819155525	609	2		20130819160525	611	2											
93	AI-XC	20131002135815	1500	1500	NR			M	380581	8	10209897	Y	46203	After he says I have alot to consider he could say paragraph 2 and after he says I need to study alot to pass it he could finish paragraph 1 up then 2.	0		20130820104227	616	0		20130820104748	615	0											
94	AI-XC	20131002135815	1500	1500	A	N	N	M	380631	8	10209898	Y	46203	However, I don't think the job is best suited for me.	1		20130819161300	616	1		20130819161431	609	1											
95	AI-XC	20131002135815	1500	1500	NR			M	380845	8	10209899	Y	46203	These are the things I do after and before school and my intrest.	0		20130820101817	615	0		20130820102209	611	1		20130821083421	609	0							
96	AI-XC	20131002135815	1500	1500	NR			F	380898	8	10209900	Y	46203	In the mean time I do variouse things while in out of school to do a god job to be able to e on the vice president for my class.	1		20130820091523	609	2		20130820092300	616	0		20130821140349	625	1							
97	AI-XC	20131002135815	1500	1500	W	Y	N	M	381168	8	10209901	Y	46203	After participating in student government, I am working at the Brick Ice Cream on Saturdays.	0		20130819145241	611	0		20130819145559	609	1		20130819153651	625	0							
98	AI-XC	20131002135815	1500	1500	H	N	N	F	381291	8	10209902	Y	46203	Running for vice president will fill up my free time.	0		20130820104824	611	2		20130820110310	609	0		20130821150337	625	0							
99	AI-XC	20131002135815	1500	1500	NR			M	381297	8	10209903	Y	46203	On the other hand I have alot of after school activities I am involved in.	1		20130820081635	609	1		20130820082906	616	1											
100	AI-XC	20131002135815	1500	1500	W	N	N	F	381373	8	10209904	Y	46203	Before deciding wheter to run fot vice president of the class, I have a lot to consider	2		20130820095010	615	2		20130820095549	616	0		20130821083421	609	2							
101	AI-XC	20131002135815	1500	1500	B	N	N	F	381401	8	10209905	Y	46203	I wanna run for president, it would be fun and I could spend a lot of time with my best friend. But I have a job at Brick Ice Cream on Saturdays, I also have swim practice everyday at 6 a.m. on top of that my Biology class is getting hard and I need a lot of studying to pass it. I don't think that I should run for any political oraganization at this mommet.	0		20130820074422	609	0		20130820075711	616	0											
102	AI-XC	20131002135815	1500	1500	W	N	N	F	381402	8	10209906	Y	46203	I have heard the colleges are impressed with students who have participated in student government and important work and activities: ...	0		20130820102708	609	0		20130820103839	615	0											
103	AI-XC	20131002135815	1500	1500	B	N	N	F	381406	8	10209907	Y	46203	"... ""I have heard that colleges are impressed with students eho have participated in student government"".., but ""I am working ...."""	0		20130820082934	609	0		20130820083636	616	0											
104	AI-XC	20131002135815	1500	1500	B	N	N	M	381635	8	10209908	Y	46203	I have to save time for both of my jobs	1		20130820083731	609	1		20130820084416	616	0		20130820133924	625	1							
105	AI-XC	20131002135815	1500	1500	NR			F	381693	8	10209909	Y	46203	students that have done good.	0		20130820091507	615	0		20130820091653	609	0											
106	AI-XC	20131002135815	1500	1500	W	N	N	M	381745	8	10209910	Y	46203	Before deciding whether to run for vice president of the class,I have alot to consider: I have swim practice every day at 6 a.am. and Biology.	0		20130819161300	616	0		20130819161431	609	0											
